Unnamed: 0,Thời gian,Tiêu đề,URL,content
45,02/08/2025 08:58,"Gọi tên 10 DN bất động sản báo lãi tăng mạnh nhất sàn chứng khoán quý 2/2025, có công ty tăng đến 4.009%",https://cafef.vn/goi-ten-10-dn-bat-dong-san-bao-lai-tang-manh-nhat-san-chung-khoan-quy-22025-co-cong-ty-tang-den-4009-188250802085843833.chn?utm_source=du-lieu.chn,"Tính đến hiện tại, hầu hết các doanh nghiệp bất động sản niêm yết đã công bố BCTC quý 2/2025. Ghi nhận, tăng trưởng lợi nhuận chiếm đa số, Top các công ty đạt mức tăng trưởng mạnh nhất chủ yếu nhờ hoạt động cốt lõi.
Ngược lại, vẫn còn rải rác các doanh nghiệp đang trong quá trình tái cơ cấu báo lỗ, đơn cử Novaland (NVL), CTCP Đầu tư LDG (LDG)…
Trong kỳ, dẫn đầu mức tăng là CTCP Đầu tư và Phát triển Bất động sản An Gia (AGG), quý 2/2025 Công ty ghi nhận doanh thu thuần đạt 194 tỷ - tăng 15% so với cùng kỳ năm trước. Xét về cơ cấu, doanh thu từ bán và cho thuê căn hộ dài hạn chiếm gần 75% tổng doanh thu, đạt 145 tỷ đồng. Theo sau là doanh thu dịch vụ tư vấn, chiếm 23%, đạt 45 tỷ đồng, cao gấp 15 lần cùng kỳ và doanh thu dịch vụ khác, chiếm 2%, đạt 3,3 tỷ đồng.
Sau khi trừ các khoản chi phí phát sinh trong kỳ, An Gia thu về 105 tỷ lãi trước thuế - tăng 4.009% và 82 tỷ đồng lợi nhuận sau thuế, tăng mạnh so với mức 1,6 tỷ đồng của quý 2/2024.
Lũy kế 6 tháng đầu năm, An Gia ghi nhận doanh thu thuần đạt 386 tỷ đồng, lợi nhuận sau thuế 90 tỷ - giảm 58%.
Tăng trưởng hàng ngàn % còn có Địa ốc First Real (FIR). Quý 3 năm tài chính 2025, doanh thu thuần của Công ty đạt hơn 43 tỷ đồng, tăng 205%; lợi nhuận trước thuế trong kỳ đạt gần 19 tỷ đồng, tăng 1.100% so với cùng kỳ năm trước.
Lũy kế 9 tháng (1/10/2024 - 30/6/2025), FIR đạt 22 tỷ lãi trước thuế, tăng gần 51% so với cùng kỳ năm trước. Được biết, tăng trưởng Công ty đến từ sự phục hồi đáng kể từ thị trường bất động sản, đặc biệt là khu vực miền Trung - nơi FIR có lợi thế về quỹ đất và năng lực triển khai dự án.
TTC Land (SCR) đứng Top 3 về tăng trưởng với doanh thu trong quý vừa qua đạt 409 tỷ đồng, gấp 5,4 lần cùng kỳ năm trước. Trừ đi các chi phí, Công ty lãi trước thuế 45 tỷ đồng, tăng 392% so với quý 2/2024.
Lũy kế 6 tháng đầu năm, TTC Land đạt 519 tỷ đồng doanh thu, gấp 3,6 lần; lợi nhuận trước thuế đạt hơn 51 tỷ đồng, tăng 214%.
Cần nhấn mạnh, ngoài doanh thu bán hàng cải thiện thì doanh thu tài chính hỗ trợ lớn cho kết quả kinh doanh của TTC Land, với 168 tỷ. Đây chủ yếu là lãi cho vay và hoạt động đầu tư. Tại thời điểm cuối quý 2/2025, Công ty có hơn 500 tỷ đồng tiền gửi ngân hàng, hơn 1.700 tỷ đồng cho vay các bên liên quan lấy lãi, hơn 900 tỷ đồng đầu tư góp vốn vào đơn vị khác.
Kết quả khả quan được đưa ra trong bối cảnh thị trường đang dần hồi phục. Nhiều dự án lớn sắp có kế hoạch tái khởi động, song song lượng cung đã bắt đầu tăng trở lại ở cả hai miền, đặc biệt tại hai thành phố lớn là Hà Nội và Tp.HCM.
Thị trường đang hồi phục, nguồn cung dự kiến tăng tốt
Trong báo cáo thị trường mới công bố, JLL dự báo năm 2025, thị trường Tp.HCM dự kiến sẽ chào đón lần lượt khoảng 5.000 – 5.500 căn hộ phân khúc cao và 1.300 căn nhà liền thổ mới. Theo JLL, các công trình hạ tầng được đẩy mạnh triển khai như Nhà ga mở rộng T3, nút giao An Phú, tuyến đường Vành Đai 3 dự kiến là những động lực thúc đẩy thị trường trong năm. Bên cạnh đó, việc UBND Tp.HCM xem xét giải quyết các vướng mắc pháp lý cho các dự án trọng điểm cũng được kỳ vọng sẽ giúp thị trường khởi sắc hơn trong các quý tiếp theo của năm 2025.
Dù vậy, JLL cho rằng trong bối cảnh Việt Nam đang thực hiện cơ cấu lại địa giới hành chính của các địa phương, các chủ đầu tư và người mua nhà tại Tp.HCM dự kiến sẽ trải qua một giai đoạn thận trọng tạm thời, và chờ đợi sự chắc chắn hơn trong chính sách quản lý, quy hoạch đất đai và đầu tư công trong giai đoạn tới để đưa ra quyết định đầu tư. Trong khi đó, các địa phương vệ tinh như Bình Dương, Bà Rịa – Vũng Tàu dự kiến sẽ nhận được nhiều sự chú ý, với kỳ vọng được đầu tư mạnh mẽ vào hạ tầng giao thông và các công trình công cộng, nhằm kết nối và phát triển kinh tế vùng sau khi sáp nhập với Tp.HCM.
Với thị trường Hà Nội, JLL nhấn mạnh căn hộ phân khúc cao sẽ sôi động hơn nữa vào trong 12 tháng tới, với đa dạng nguồn cung đang tiếp thị, như Sun Flezia Suites (bởi Sun Group), Westlake Residential (bởi Vinaenco) hay The Jade Square (by Vimedimex). Sự khan hiếm các dự án tích hợp tiện ích và xu hướng tăng giá chung toàn thị trường, càng thúc đẩy cho mức định giá cao của các sản phẩm mới.
Do vậy, mức cạnh tranh trong phân khúc này cũng gia tăng mạnh mẽ hơn, và với mức giá này, nguồn cầu chủ yếu sẽ đến từ người mua để ở thực, thay vì đầu tư như giai đoạn 2023-2024.
Vẫn còn nhiều bên lỗ lớn do gánh nặng chi phí
Ngược lại, Novaland tiếp tục một quý lỗ lớn do gánh nặng chi phí. Theo BCTC hợp nhất quý 2/2025, Novaland đạt doanh thu hơn 1.936 tỷ đồng, tăng 22% so với cùng kỳ. Trừ chi phí, Novaland lỗ ròng gần 190 tỷ.
Luỹ kế 6 tháng đầu năm, Novaland đạt doanh thu thuần gần 3.423 tỷ đồng từ bàn giao tại loạt dự án lớn như NovaWorld Phan Thiet, Ho Tram, Aqua City, Sunrise Riverside, Palm City... Doanh thu dịch vụ đạt 291 tỷ đồng, nâng tổng doanh thu hợp nhất lên hơn 3.715 tỷ đồng.
Tuy nhiên, công ty vẫn ghi nhận khoản lỗ sau thuế 666 tỷ đồng, nguyên nhân chính là lỗ tỷ giá và chi phí khác. Dù vậy, mức lỗ này vẫn thấp hơn rất nhiều so với con số hơn 7.300 tỷ đồng cùng kỳ năm ngoái.
Hay CTCP Đầu tư LDG, quý 2 dù doanh thu thuần tăng 118% song Công ty vẫn lỗ sau thuế hơn 66 tỷ đồng. Nửa đầu năm, Công ty lỗ gần 54 tỷ. LDG là doanh nghiệp địa ốc được chú ý thời gian gần đây, khi liên tục tăng trần sau khi nguyên Chủ tịch là ông Nguyễn Khánh Hưng tái xuất sau khi ra tù, tuyên bố sẽ tiếp tục dẫn dắt Công ty phát triển trong hành trình mới.
Năm 2025, LDG lên kế hoạch đầy tham vọng với doanh thu hơn 1.800 tỷ đồng - tăng gấp gần 10 lần năm ngoái, lợi nhuận sau thuế gần 92 tỷ đồng. Công ty cho biết đang triển khai 9 dự án, trong đó 5 dự án lớn như LDG Grand Đà Nẵng, LDG Sky, West/High Intela… dự kiến sẽ được chuyển nhượng hoặc thoái vốn."
46,31/07/2025 08:21,"Doanh thu tăng 141% so với cùng kỳ, Phát Đạt báo lãi quý 2/2025 tăng 30%, đạt 65 tỷ đồng",https://cafef.vn/doanh-thu-tang-141-so-voi-cung-ky-phat-dat-bao-lai-quy-22025-tang-30-dat-65-ty-dong-188250731082402793.chn?utm_source=du-lieu.chn,"CTCP Phát triển Bất động sản Phát Đạt (mã: PDR) vừa công bố báo cáo tài chính quý II/2025. Phát Đạt cho biết, thị trường kinh tế có nhiều khởi sắc so với năm trước, hoạt động kinh doanh bất động sản của công ty tương đối thuận lợi.
Theo đó, doanh thu thuần quý II/2025 của PDR đạt gần 20 tỷ đồng, tăng 141% so với cùng kỳ năm trước. Doanh thu chủ yếu đến từ chuyển nhượng bất động sản, cung cấp dịch vụ và cho thuê bất động sản. Lợi nhuận sau thuế đạt 65 tỷ đồng, tăng 30% so với mức gần 50 tỷ đồng của quý II/2024.
Một trong những yếu tố chính góp phần vào tăng trưởng lợi nhuận là doanh thu tài chính tăng mạnh. Cụ thể, trong quý II, doanh thu tài chính đạt 226 tỷ đồng, tăng 23 tỷ đồng so với cùng kỳ. Trong đó, khoản thu từ chuyển nhượng cổ phần chiếm 140 tỷ đồng giảm 61 tỷ đồng so với năm trước. Tuy nhiên, trong kỳ, PDR ghi nhận hoàn nhập chênh lệch tỷ giá 84 tỷ đồng nhờ chuyển đổi khoản vay ACA thành vốn góp, ì vậy làm cho làm doanh thu tài chính tăng.
Bên cạnh đó, chi phí tài chính và chi phí quản lý doanh nghiệp cũng được tiết giảm đáng kể nhờ hiệu quả ban đầu từ hoạt động tái cấu trúc.
Lũy kế 6 tháng đầu năm 2025, Phát Đạt đạt doanh thu thuần 458 tỷ đồng, tăng 168% so với cùng kỳ năm ngoái. Lợi nhuận sau thuế đạt gần 116 tỷ đồng, tăng 13,4%.
Tại ngày 30/6/2025, tổng tài sản hợp nhất đạt 24.226 tỷ đồng, tăng nhẹ so với cuối năm 2024. Vốn chủ sở hữu đạt 11.856 tỷ đồng, với lợi nhuận sau thuế chưa phân phối lũy kế là 2.066 tỷ đồng.
Tại Đại hội đồng cổ đông thường niên năm 2025, Ban lãnh đạo Phát Đạt khẳng định sẽ tập trung phát triển mạnh tại địa bàn TP.HCM (mới) và Đồng Nai (mới). Sau khi hai tỉnh Bình Dương và Bà Rịa – Vũng Tàu được sáp nhập vào TP.HCM, tổng quỹ đất thuộc địa bàn TP.HCM hiện nay của công ty lên tới hơn 500ha.
Với quỹ đất như vậy, ông Nguyễn Văn Đạt - Chủ tịch Phát Đạt chia sẻ sẽ tập trung phát triển phân khúc cao tầng tại Bình Dương (cũ). Còn ở Bà Rịa – Vũng Tàu (cũ) có thể phát triển phân khúc trung cấp hoặc cao cấp tùy vị trí, có thể ở Hồ Tràm sẽ phát triển condotel, villa…
Bên cạnh đó, ban lãnh đạo Phát Đạt cho biết, trong năm 2025, công ty sẽ đẩy mạnh bán hàng, mang về dòng tiền lớn thông qua các dự án trọng điểm như Quy Nhơn Iconic, khu nhà ở phức hợp cao tầng Thuận An 1 và 2, khu phức hợp nghỉ dưỡng tại Côn Đảo, khu thương mại dịch vụ Serenity Phước Hải, khu du lịch Bến Thành – Long Hải và khu thương mại dịch vụ Như Nguyệt.
Cũng tại ĐHĐCĐ 2025, Phát Đạt thông qua kế hoạch doanh thu hợp nhất cả năm 3.300 tỷ đồng và lợi nhuận sau thuế 728 tỷ đồng."
47,31/07/2025 00:00,PDR: Giải trình KQKD quý 2/2025 so với cùng kỳ năm trước,https://cafef.vn/du-lieu/PDR-2282469/pdr-giai-trinh-kqkd-quy-22025-so-voi-cung-ky-nam-truoc.chn?utm_source=du-lieu.chn,
48,30/07/2025 00:00,"PDR: 4.8.2025, ngày GDKHQ trả cổ tức bằng cổ phiếu (tỷ lệ 100:8)",https://cafef.vn/du-lieu/PDR-2268241/pdr-482025-ngay-gdkhq-tra-co-tuc-bang-co-phieu-ty-le-1008.chn?utm_source=du-lieu.chn,
49,29/07/2025 08:15,"Dự án của Phát Đạt, Đại Quang Minh, DIC, Investco, Hưng Lộc Phát... nằm trong diện bị thanh tra",https://cafef.vn/du-an-cua-phat-dat-dai-quang-minh-dic-investco-hung-loc-phat-nam-trong-dien-bi-thanh-tra-188250729080012939.chn?utm_source=du-lieu.chn,"Cụ thể, theo danh sách, Tp.HCM có tổng cộng 114 dự án (20 do Thanh tra chính phủ trực tiếp thanh tra và 94 do địa phương thanh tra). Danh sách có nhiều dự án chậm triển khai, vướng pháp lý kéo dài hoặc có khiếu kiện liên quan đến thủ tục đất đai.
Dưới là danh sách 20 dự án do Thanh tra Chính phủ trực tiếp thanh tra, trong đó có  dự án của các chủ đầu tư quen thuộc trên thị trường như Đại Quang Minh, Investco, Phát Đạt, Hưng Lộc Phát, DIC, Công ty phát triển công nghiệp Tân Thuận, Công ty CP Đầu tư Phú Mỹ...
Ngoài Tp.HCM, các địa phương khác có số lượng lớn dự án thanh tra gồm: An Giang (92), Đồng Nai (85), Khánh Hòa (83), Ninh Bình (46), Lâm Đồng (30), Bắc Ninh (27), Vĩnh Long (13), TP Đà Nẵng (11)...
Việc thanh tra sẽ bắt đầu trong tháng 7, kết luận được yêu cầu ban hành trước ngày 25/9 đối với Thanh tra Chính phủ và 15/9 đối với cấp địa phương. Kết quả tổng hợp sẽ được báo cáo Thủ tướng vào đầu tháng 10/2025.
Theo Thanh tra chính phủ, đây được xem là một trong những đợt thanh tra diện rộng trong nhiều năm, kỳ vọng sẽ làm rõ nguyên nhân chậm trễ, sai phạm nếu có và kiến nghị giải pháp khắc phục, nhằm đưa các dự án nhanh chóng đi vào thực tế, tránh lãng phí tài nguyên và đất đai."
50,29/07/2025 00:00,PDR: Báo cáo tình hình quản trị 6 tháng đầu năm 2025,https://cafef.vn/du-lieu/PDR-2282542/pdr-bao-cao-tinh-hinh-quan-tri-6-thang-dau-nam-2025.chn?utm_source=du-lieu.chn,
51,24/07/2025 00:00,PDR: Thông báo ngày ĐKCC để thực hiện quyền nhận cổ tức bằng cổ phiếu cho cổ đông hiện hữu,https://cafef.vn/du-lieu/PDR-2253502/pdr-thong-bao-ngay-dkcc-de-thuc-hien-quyen-nhan-co-tuc-bang-co-phieu-cho-co-dong-hien-huu.chn?utm_source=du-lieu.chn,
52,24/07/2025 00:00,PDR: Thông báo về việc nhận được công văn của UBCKNN về tài liệu báo cáo phát hành cổ phiếu để trả cổ tức,https://cafef.vn/du-lieu/PDR-2255738/pdr-thong-bao-ve-viec-nhan-duoc-cong-van-cua-ubcknn-ve-tai-lieu-bao-cao-phat-hanh-co-phieu-de-tra-co-tuc.chn?utm_source=du-lieu.chn,
53,18/07/2025 00:00,PDR: Thông báo ký hợp đồng kiểm toán BCTC 2025,https://cafef.vn/du-lieu/PDR-2251068/pdr-thong-bao-ky-hop-dong-kiem-toan-bctc-2025.chn?utm_source=du-lieu.chn,
54,16/07/2025 00:00,PDR: Quyết định của HĐQT triển khai phương án phát hành và hồ sơ phát hành cổ phiếu để trả cho CĐHH,https://cafef.vn/du-lieu/PDR-2247252/pdr-quyet-dinh-cua-hdqt-trien-khai-phuong-an-phat-hanh-va-ho-so-phat-hanh-co-phieu-de-tra-cho-cdhh.chn?utm_source=du-lieu.chn,
55,14/07/2025 00:00,PDR: Ông Nguyễn Tấn Danh - Phó chủ tịch HĐQT đã bán 3.397.652 cp,https://cafef.vn/du-lieu/PDR-2245551/pdr-ong-nguyen-tan-danh-pho-chu-tich-hdqt-da-ban-3397652-cp.chn?utm_source=du-lieu.chn,
56,03/07/2025 00:00,PDR: Đính chính nội dung Bản sửa đổi điều lệ công ty,https://cafef.vn/du-lieu/PDR-2237115/pdr-dinh-chinh-noi-dung-ban-sua-doi-dieu-le-cong-ty.chn?utm_source=du-lieu.chn,
57,30/06/2025 00:00,"PDR: Bản sửa đổi Điều lệ công ty, Quy chế nội bộ về quản trị công ty, Quy chế hoạt động của HĐQT",https://cafef.vn/du-lieu/PDR-2233619/pdr-ban-sua-doi-dieu-le-cong-ty-quy-che-noi-bo-ve-quan-tri-cong-ty-quy-che-hoat-dong-cua-hdqt.chn?utm_source=du-lieu.chn,
58,30/06/2025 00:00,PDR: Bổ nhiệm ông Vũ Thành Lê giữ chức Thành viên độc lập HĐQT từ 27.6.2025,https://cafef.vn/du-lieu/PDR-2234234/pdr-bo-nhiem-ong-vu-thanh-le-giu-chuc-thanh-vien-doc-lap-hdqt-tu-2762025.chn?utm_source=du-lieu.chn,
59,30/06/2025 00:00,PDR: Biên bản họp và Nghị quyết ĐHĐCĐ thường niên năm 2025,https://cafef.vn/du-lieu/PDR-2234404/pdr-bien-ban-hop-va-nghi-quyet-dhdcd-thuong-nien-nam-2025.chn?utm_source=du-lieu.chn,
60,28/06/2025 08:25,"Chủ tịch Phát Đạt: Sau khi sáp nhập hai địa phương Bà Rịa - Vũng Tàu và Bình Dương vào TP.HCM, tổng quỹ đất của công ty gần 1.000 ha",https://cafef.vn/chu-tich-phat-dat-sau-khi-sap-nhap-hai-dia-phuong-ba-ria-vung-tau-va-binh-duong-vao-tphcm-tong-quy-dat-cua-cong-ty-gan-1000-ha-188250628074247917.chn?utm_source=du-lieu.chn,"Ông Nguyễn Văn Đạt - Chủ tịch CTCP Phát triển Bất động sản Phát Đạt (mã: PDR)
Ngày 27/6, Công ty Cổ phần Phát triển Bất động sản Phát Đạt (mã: PDR) đã tổ chức Đại hội đồng Cổ đông thường niên năm 2025.
Theo đó, trong năm 2025, Phát Đạt lên kế hoạch tổng doanh thu 3.300 tỷ đồng và lãi sau thuế 728 tỷ đồng, gấp hơn 4 lần kết quả đạt được trong năm 2024.
Phát Đạt cũng dự kiến phát hành cổ phiếu để chi trả cổ tức năm 2024 với tỷ lệ 8% trên tổng số cổ phiếu đang lưu hành, đồng thời phát hành 18 triệu cổ phiếu theo chương trình lựa chọn cho người lao động trong năm 2025 (chương trình ESOP 2025) với giá 10.000 đồng/ cổ phiếu.
Dự kiến năm 2026, PDR chia cổ tức cho cổ đông bằng tiền và cổ phiếu từ lợi nhuận sau thuế kết dư đến ngày 31/12/2025 với tỷ lệ 17% vốn Điều lệ tại thời điểm thực hiện. Trong đó, chia cổ tức bằng tiền 05%, chia cổ tức bằng cổ phiếu 12%.
Theo ban lãnh đạo Phát Đạt, trong năm 2025, công ty sẽ đẩy mạnh bán hàng, mang về dòng tiền lớn thông qua các dự án trọng điểm như Quy Nhơn Iconic, khu nhà ở phức hợp cao tầng Thuận An 1 và 2, khu phức hợp nghỉ dưỡng tại Côn Đảo, khu thương mại dịch vụ Serenity Phước Hải, khu du lịch Bến Thành – Long Hải và khu thương mại dịch vụ Như Nguyệt.
Cùng với đó, công ty cũng sẽ đẩy mạnh mở rộng quỹ đất và phát triển sản phẩm căn hộ tại khu Đông Sài Gòn, gồm Đồng Nai, Bình Dương và đất biển Bà Rịa – Vũng Tàu.
Một điểm nhấn quan trọng trong chiến lược 2025 là tái định nghĩa mô hình kinh doanh theo hướng Human-Centric, lấy trải nghiệm cư dân và giá trị cộng đồng làm trung tâm. Phát Đạt hướng tới kiến tạo các hệ sinh thái sống tích hợp, vận hành thông minh và kết nối công nghệ.
Để hiện thực hóa chiến lược này, công ty đẩy mạnh ứng dụng công nghệ số vào chuỗi quản trị và vận hành: hệ thống CRM tích hợp AI, tham quan thực tế ảo (VR), cảm biến IoT và nền tảng cư dân số…
Ngoài ra, Phát Đạt còn tăng cường hợp tác quốc tế bằng việc chủ động nội địa hóa các mô hình phát triển bất động sản tiên tiến, triển khai chiến lược M&A có chọn lọc và mở rộng hợp tác chiến lược với đối tác toàn cầu.
Toàn cảnh ĐHĐCĐ Phát Đạt diễn ra sáng ngày 27/6.
Tại Đại hội, Chủ tịch Nguyễn Văn Đạt chia sẻ 2 thông tin mới nhất. Một, công ty được phê duyệt hai dự án tại TP Thủ Dầu Một, Bình Dương theo Nghị quyết 171. Hội đồng dân tỉnh Bình Dương đã thông qua hai dự án này để làm thí điểm với tổng quy mô 45 ha và khu đất này có thể làm dự án cao tầng. Với 45 ha, các dự án gấp 11 lần so với quy mô dự án Lapura (tên gọi cũ là Astral City).
Hai, tất cả dự án BT của Phát Đạt mặc dù không được định trong giá trị cổ phiếu nhưng đến nay đã có nhiều kết quả tích cực. Trong đó, UBND TP.HCM đã thống nhất cho Phát Đạt triển khai tiếp dự án BT Cổ đại và được được đổi quỹ đất Cù lao Bà Sang.
Đối với dự án nhà thi đấu Phan Đình Phùng, Phát Đạt đủ điều kiện để triển khai chi tiết nhưng thành phố muốn chuyển dự án sang hình thức đầu tư công nên các bên vẫn đang làm việc.
Ở phần thảo luận, cổ đông hỏi về kết quả kinh doanh nửa đầu năm nay và mục tiêu doanh thu 50.000 tỷ đồng đến từ động lực nào?
Ông Bùi Quang Anh Vũ - Tổng giám đốc Phát Đạt cho biết, trong quý II, công ty đạt doanh thu 520 tỷ đồng, lãi sau thuế 66 tỷ, tổng lãi trong nửa đầu năm 117 tỷ đồng. Kết quả kinh doanh nửa cuối năm sẽ được ghi nhận dự án Bắc Hà Thanh (Quy Nhơn Iconic), chuyển nhượng cổ phần tại các công ty con và mảng dịch vụ khác.
Liên quan đến mục tiêu tổng doanh thu 50.000 tỷ đồng, Chủ tịch Phát Đạt chia sẻ rằng, trước đây chúng ta công bố 6 dự án thì hiện nay chúng ta đang trong giai đoạn chuyển nhượng hai dự án. Mục tiêu này được đưa ra để thực hiện trong nhiều năm tới, bao gồm các hoạt động chuyển nhượng chứ không chỉ quỹ đất có thể trực tiếp kinh doanh, bán hàng. Việc chuyển nhượng Quy Nhơn Iconic chúng ta vẫn đang đàm phán. Thị trường mục tiêu mà chúng tôi đang quan tâm là Bình Dương và Đồng Nai.
Chia sẻ thêm về kế hoạch phát triển thời gian tới, ông Nguyễn Văn Đạt cho biết, thời gian vừa rồi Phát Đạt có công bố thoái khỏi mảng khu công nghiệp và hiện tại đã tập trung trở lại, sắp tới sẽ được chấp thuận đầu tư quỹ đất vài trăm ha ở Quảng Nam.
Phát Đạt có quỹ đất vài trăm ha ở Bình Dương và đang tiếp tục kinh doanh. Ở Bà Rịa – Vũng Tàu, Phát Đạt có tổng quỹ đất khoảng 52 ha. Sau khi sáp nhập hai địa phương này vào TP.HCM, tổng quỹ đất của công ty gần 1.000 ha.
""Sở dĩ chúng ta tiếp tục đầu tư mới tại Đồng Nai vì tôi nghĩ rằng sân bay Long Thành chuẩn bị cất cánh và kết nối giao thông rất tốt với các vùng kinh tế. Thời gian ngắn gần đây chúng tôi mới đưa ra quyết định này.
Với quỹ đất như vậy, Phát Đạt sẽ tập trung phát triển phân khúc cao tầng tại Bình Dương. Còn ở Bà Rịa – Vũng Tàu có thể phát triển phân khúc trung cấp hoặc cao cấp tùy vị trí, có thể ở Hồ Tràm sẽ phát triển condotel, villa…
Tùy theo nhu cầu khách hàng mà chúng ta sẽ đưa ra sản phẩm phù hợp, xác định đâu là dự án có thể triển khai trước"", Chủ tịch Phát Đạt chia sẻ.
Về nhân sự, ĐHĐHCĐ Phát Đạt cũng thống nhất bầu bổ sung ông Vũ Thành Lê vào hội đồng quản trị nhiệm kỳ 2025-2028."
