Unnamed: 0,Thời gian,Tiêu đề,URL,content
138,30/08/2024 00:00,PDR: Con ông Nguyễn Văn Đạt - Chủ tịch HĐQT đăng ký bán 1.086.819 cp,https://cafef.vn/du-lieu/PDR-2049337/pdr-con-ong-nguyen-van-dat-chu-tich-hdqt-dang-ky-ban-1086819-cp.chn?utm_source=du-lieu.chn,
139,30/08/2024 00:00,PDR: Ông Nguyễn Tấn Danh - Phó chủ tịch HĐQT đăng ký bán 617.754 cp,https://cafef.vn/du-lieu/PDR-2049343/pdr-ong-nguyen-tan-danh-pho-chu-tich-hdqt-dang-ky-ban-617754-cp.chn?utm_source=du-lieu.chn,
140,29/08/2024 00:00,PDR: Giải trình chênh lệch lợi nhuận sau thuế 6 tháng đầu năm 2024 so với 6 tháng đầu năm 2023,https://cafef.vn/du-lieu/PDR-2045902/pdr-giai-trinh-chenh-lech-loi-nhuan-sau-thue-6-thang-dau-nam-2024-so-voi-6-thang-dau-nam-2023.chn?utm_source=du-lieu.chn,
141,25/08/2024 19:01,"Phát Đạt tạm dừng trả cổ tức, ưu tiên phát hành cổ phiếu hoán đổi nợ",https://cafef.vn/phat-dat-tam-dung-tra-co-tuc-uu-tien-phat-hanh-co-phieu-hoan-doi-no-18824082519013952.chn?utm_source=du-lieu.chn,"HĐQT CTCP Phát triển Bất động sản Phát Đạt (mã: PDR) vừa qua đã công bố nghị quyết thông qua việc tạm dừng triển khai phương án phát hành cổ phiếu để trả cổ tức cho cổ đông theo nghị quyết ĐHĐCĐ thường niên năm 2024 hồi tháng 4 vừa qua.
Theo kế hoạch ban đầu, Phát Đạt dự kiến phát hành 131 triệu cổ phiếu để trả cổ tức năm 2023 với tỷ lệ 15%. Tỷ lệ thực hiện quyền là 100:15 (cổ đông sở hữu 100 cổ phiếu sẽ nhận về 15 cổ phiếu mới), qua đó tăng vốn điều lệ từ 8.731 tỷ đồng lên vượt ngưỡng 10.000 tỷ đồng.
Nguồn vốn phát hành từ lợi nhuận sau thuế chưa phân phối tại cuối năm 2023. Thời gian thực hiện dự kiến vào quý III/2024, sau khi được sử chấp thuận của các cơ quan Nhà nước có thẩm quyền.
Một dự án Phát Đạt đang triển khai
Tuy nhiên, HĐQT Phát Đạt quyết định dừng triển khai phương án trên để ưu tiên tập trung thực hiện việc phát hành cổ phiếu để hoán đổi nợ vay theo phương án đã được thông qua tại ĐHĐCĐ thường niên năm 2024, nhằm đảm bảo việc hoán đổi nợ được thực hiện theo đúng thời hạn công ty đã cam kết với đối tác.
HĐQT công ty cũng thống nhất huỷ quyết định hồi tháng 7/2024 của HĐQT về việc triển khai phương án phát hành và hồ sơ phát hành cổ phiếu để trả cổ tức cho cổ đông hiện hữu. Chủ tịch HĐQT Nguyễn Văn Đạt được giao toàn quyền quyết định và chỉ đạo thực hiện các công việc liên quan theo đúng quy định.
Về việc hoán đổi nợ, Phát Đạt dự kiến phát hành hơn 34 triệu cổ phiếu với giá 20.000 đồng/cổ phiếu (1 cổ phiếu sẽ được hoán đối 20.000 đồng nợ) để hoán đổi khoản nợ 30 triệu USD từ ACA Vietnam Real Estate III LP (Cayman Island) vào tháng 3/2022, với lãi suất cố định 8%/năm. Mục đích vay để đầu tư cho dự án Phước Hải (huyện Đất Đỏ, tỉnh Bà Rịa - Vũng Tàu).
Đây là khoản nợ nước ngoài được quyền hoán đổi dư nợ gốc thành cổ phiếu phổ thông cho bên cho vay khi Công ty thực hiện phát hành cổ phiếu để hoán đổi nợ vay và không có tài sản đảm bảo. Thời hạn hoán đổi sẽ vào ngày tròn 2 năm kể từ ngày giải ngân tối đa 50% giá trị khoản nợ.
Trước đó, trong tháng 6/2024, PDR đã phân phối thành công 134,3 triệu cổ phiếu cho 23.945 nhà đầu tư, tương đương 100% tổng số cổ phiếu chào bán ra công chúng, nâng vốn điều lệ lên 8.731 tỷ đồng như hiện nay. Trong đó, 119,9 triệu đơn vị do cổ đông thực hiện quyền và 14,4 triệu đơn vị bán cho các nhà đầu tư khác khi cổ đông bỏ quyền mua.
Với giá chào bán 10.000 đồng/CP, doanh nghiệp thu về gần 1.343 tỷ đồng. Số tiền huy động sẽ được dùng để tài trợ cho dự án đầu tư phát triển khu đô thị phân khu 2 và 9 thuộc khu đô thị du lịch sinh thái Nhơn Hội, tỉnh Bình Định; dự án khu dân cư kết hợp chỉnh trang đô thị Bắc Hà Thanh; dự án khu trung tâm tương mại dịch vụ khách sạn cao cấp; 2 dự án khu nhà ở khu phức hợp cao tầng Thuận An 1 và 2."
142,23/08/2024 00:00,PDR: Quyết định của HĐQT về việc tạm dừng triển khai phương án phát hành CP trả cổ tức và hủy QĐ số 18,https://cafef.vn/du-lieu/PDR-2044037/pdr-quyet-dinh-cua-hdqt-ve-viec-tam-dung-trien-khai-phuong-an-phat-hanh-cp-tra-co-tuc-va-huy-qd-so-18.chn?utm_source=du-lieu.chn,
143,16/08/2024 17:00,"Chủ tịch Phát Đạt báo tin vui cho cổ đông: ""Công ty mới được giao thêm đất dự án Bắc Hà Thanh, chứng tỏ PDR không có vi phạm đất đai trên 63 tỉnh, thành""",https://cafef.vn/chu-tich-phat-dat-bao-tin-vui-cho-co-dong-cong-ty-moi-duoc-giao-them-dat-du-an-bac-ha-thanh-chung-to-pdr-khong-co-vi-pham-dat-dai-tren-63-tinh-thanh-188240816164032192.chn?utm_source=du-lieu.chn,"Tại buổi gặp gỡ nhà đầu tư, ông Nguyễn Văn Đạt - Chủ tịch HĐQT Phát Đạt đã thông báo với cổ đông một tin vui.
""Phát Đạt mới được giao thêm gần 15,8 ha đất để thực hiện dự án KĐT Bắc Hà Thanh tại xã Phước Thuận, huyện Tuy Phước, tỉnh Bình Định. Như vậy, tại dự án này, Phát Đạt được giao tổng cộng 90% đất dự án. Điều này chứng tỏ Phát Đạt hoạt động không có vi phạm đất đai trên 63 tỉnh, thành thì công ty mới được cấp thêm giao đất và mới được nhận sau ngày Luật Đất đai 2024 có hiệu lực"", ông Đạt cho biết.
Phát Đạt vừa được giao thêm 15,8ha đất của Dự án Khu đô thị Bắc Hà Thanh. (Ảnh: PDR)
Chủ tịch Phát Đạt cũng chia sẻ thêm, theo Luật mới, khi giao đất, địa phương sẽ ra soát vi phạm về đất đai trên 63 tỉnh, thành. Nếu doanh nghiệp nào không vi phạm đất đai mới giao đất được.
Chia sẻ về tình hình kinh doanh của Phát Đạt trong 6 tháng đầu năm 2024, Chủ tịch Phát Đạt cho hay: ""Trong bối cảnh thị trường cực kỳ khó khăn cả về pháp lý và thị trường, mặc dù doanh thu chưa đạt kế hoạch đề ra nhưng lợi nhuận đang đi về đích. Hiện, Phát Đạt đang làm pháp lý những dự án quan trọng để chuẩn bị ra hàng"".
""6 tháng cuối năm, Phát Đạt sẽ có nhiều tin vui hơn. Chúng ta sẽ hoàn tất tính tiền sử dụng đất, hoàn tất xây dựng để đủ điều kiện mở bán tại dự án Bắc Hà Thanh trong tháng 9. Với dự án Nguyễn Thị Minh Khai - Bình Dương, chúng ta sẽ tính tiền sử dụng đất trong tháng 10 và tháng 11 sẽ đủ điều kiện bán hàng. Hiện tại, Phát Đạt đang rất thuận lợi"", ông Nguyễn Văn Đạt nói.
Nói về nguồn lực phát triển dự án, ông Bùi Quang Anh Vũ - Tổng giám đốc Phát Đạt cho biết: ""Phát Đạt đã chuẩn bị kỹ lưỡng nguồn lực tài chính để phát triển thời gian sắp tới. Về tài chính, PDR đã phát hành thành công cổ phiếu riêng lẻ và phát hành cho cổ đông hiện hữu, chúng ta đã thu đủ tiền. Bên cạnh đó, Phát Đạt được sự tài trợ của ngân hàng lớn cho việc phát triển dự án, bán hàng, đặc biệt có những gói tài trợ hấp dẫn cho khách hàng sau này phục vụ bán hàng"".
Về nguồn lực quỹ đất, ông Vũ chia sẻ, Phát Đạt đang chuẩn bị hoàn thành một số quỹ đất lớn và tốt. Sắp tới, công ty có hai dự án sắp đi về đích. Công ty sẽ tập trung nỗ lực bán hàng 2 dự án này để mang lại dòng tiền lớn, tạo nguồn phát triển cho PDR trong thời gian sắp tới.
Đưa ra đánh giá chung về thị trường bất động, Chủ tịch Nguyễn Văn Đạt cho rằng: ""Trong mấy năm vừa qua, thị trường trầm lắng. Đó là thời gian sàng lọc bớt những doanh nghiệp yếu. Nếu doanh nghiệp nào tồn tại đến ngày hôm nay thì trong vòng khoảng 4 tháng nữa, mọi việc sẽ rất tốt. Hiện nay, các dự án ở Bình Dương, mức tiêu thụ tốt, giá cao. Giao dịch đất nền tốt. Giá chung cư cũng tốt. Còn tại Bình Định - nơi Phát Đạt đang phát triển, đất nền phân lô không có sản phẩm đưa ra"".
Còn về phía doanh nghiệp, ông Đạt cho rằng: ""Tôi nghĩ rằng những doanh nghiệp chịu đựng không nổi trong thời gian vừa qua đã bộc lộ nhiều rồi. Còn những doanh nghiệp sức chịu đựng tốt hơn thì trong tương lại gần, chậm nhất là năm 2025 mọi thứ sẽ rất tốt"".
Ông Bùi Quang Anh Vũ - Tổng giám đốc Phát Đạt cũng cho rẳng: ""Với chính sách mới luật quy định, đặc biệt Luật Đất đai sẽ sàng lọc các nhà đầu tư. Đối với nhà đầu tư có thương hiệu, uy tín, tiềm lực tài chính, quỹ đất, có khả năng làm pháp lý, xây dựng ra những sản phẩm tốt... sẽ trụ vững trên thị trường. Tôi cho rằng những chính sách mới là để sang lọc các doanh nghiệp nhưng cũng là cơ hội tạo sân chơi cho các đơn vị lớn trong ngành""."
144,05/08/2024 19:10,Các đại gia bất động sản TP HCM trả lương nhân viên thế nào?,https://cafef.vn/cac-dai-gia-bat-dong-san-tp-hcm-tra-luong-nhan-vien-the-nao-188240805161150824.chn?utm_source=du-lieu.chn,"Công ty CP Đầu tư và Kinh doanh Nhà Khang Điền (mã chứng khoán: KDH), trụ sở tại TP HCM, mới đây công bố báo cáo tài chính quý II/2024 ghi nhận doanh thu thuần 644 tỉ đồng, tăng 9,8% so với cùng kỳ và doanh thu hoạt động tài chính tăng 36%, lên mức 10,4 tỉ đồng.
Sau khi trừ các chi phí, công ty này lãi ròng 280 tỉ đồng, tăng 9,3% so với cùng kỳ năm trước. Tính chung 6 tháng đầu năm, Khang Điền ghi nhận doanh thu thuần và lợi nhuận sau thuế ở mức 978 tỉ đồng và 344 tỉ đồng, lần lượt giảm 2,8% và 24,7% so với cùng kỳ.
Tính đến cuối quý II/2024, danh mục tiền và các khoản tương đương tiền của Nhà Khang Điền có giá trị 2.561 tỉ đồng (giảm hơn 1.000 tỉ đồng so với đầu năm), trong đó các khoản tiền gửi ngân hàng có kỳ hạn gốc không quá 3 tháng chiếm đến 79%, ở mức 2.206 tỉ đồng.
Đến cuối tháng 6-2024, doanh nghiệp này có 255 nhân viên, giảm 3 người so với cuối năm 2023; tổng chi phí nhân viên 55,6 tỉ đồng. Như vậy, bình quân mỗi nhân viên của doanh nghiệp bất động sản này nhận khoảng 36 triệu đồng/tháng, cao hơn gần 8 triệu đồng so với cùng kỳ.
Khang Điền là doanh nghiệp bất động sản trả lương nhân viên cao nhất trong 6 tháng đầu năm.
Kế đó, Công ty CP Phát triển Bất động sản Phát Đạt (mã chứng khoán: PDR) - một trong những nhà phát triển bất động sản TP HCM, trong quý II/2024 ghi nhận chi phí lương ở mức 27,2 tỉ đồng, cao hơn 2,8 tỉ đồng so với cùng kỳ năm trước.
Nguyên nhân có thể là do số lượng nhân viên của Phát Đạt đến cuối tháng 6-2024 cao hơn 21 người so với cuối năm 2023, đạt 278 người. Tạm tính với số lượng nhân viên này trong quý II, ước tính tiền lương mỗi người nhận được khoảng 32,6 triệu đồng/tháng, cao gần gấp đôi cùng kỳ.
Về kết quả kinh doanh trong quý II/2024, doanh thu thuần của doanh nghiệp này đạt mức 8,2 tỉ đồng, cao hơn gấp 3 lần cùng kỳ. Tuy nhiên, nhờ doanh thu tài chính, Phát Đạt báo lãi sau thuế 49,7 tỉ đồng, giảm 82% so với cùng kỳ năm trước.
Lũy kế 6 tháng đầu năm, Phát Đạt ghi nhận doanh thu thuần 170 tỉ đồng, giảm 12% so với cùng kỳ và lãi sau thuế giảm 66% so với cùng kỳ năm trước, chỉ đạt 102,4 tỉ đồng, hoàn thành 12% kế hoạch lợi nhuận của năm 2024.
Công ty CP Tập đoàn Đất Xanh (mã chứng khoán: DXG) tính đến cuối tháng 6-2024 có khoảng 2.443 người, giảm 25 người so với cuối năm 2023 và chi phí lương 157,9 tỉ đồng, tăng nhẹ so với cùng kỳ. Tạm tính bình quân nhân viên của Đất Xanh nhận lương gần 10,8 triệu đồng/tháng, tăng nhẹ so với cùng kỳ.
Lũy kế nửa đầu năm 2024, doanh thu và lợi nhuận sau thuế của Đất Xanh lần lượt tăng gấp đôi và gấp 4,3 lần so với cùng kỳ, ở mức 2.191 tỉ đồng và 171 tỉ đồng.
Tính đến cuối quý II/2024, giá trị danh mục tiền và các khoản tương đương tiền của doanh nghiệp này so với cuối năm 2023 tăng mạnh 287%, từ 276 tỉ đồng lên mức 1.069 tỉ đồng."
145,22/07/2024 14:58,"Con gái Chủ tịch HĐQT Phát Đạt ""quay xe"" không bán cổ phiếu PDR như đăng ký",https://cafef.vn/con-gai-chu-tich-hdqt-phat-dat-quay-xe-khong-ban-co-phieu-pdr-nhu-dang-ky-188240722143701785.chn?utm_source=du-lieu.chn,"CTCP Phát triển Bất động sản Phát Đạt (mã: PDR) vừa báo cáo kết quả giao dịch cổ phiếu của người có liên quan đến người nội bộ Nguyễn Thị Minh Thư, con gái ông Nguyễn Văn Đạt, Chủ tịch HĐQT PDR.
Theo đó, bà Thư không bán cổ phiếu PDR nào trên tổng số gần 1,1 triệu cổ phiếu đã đăng ký trước đó, nguyên nhân đưa ra là do thay đổi kế hoạch tài chính. Lượng cổ phiếu PDR bà Thư nắm giữ được giữ nguyên hơn 7 triệu cổ phiếu, chiếm 0,81% cổ phần.
Tương tự bà Thư, Phó Chủ tịch HĐQT Bất động sản Phát Đạt là ông Nguyễn Tấn Danh thông báo không bán bất kỳ cổ phiếu nào trên tổng 618 nghìn đơn vị đã đăng ký, lý do cũng là thay đổi kế hoạch tài chính. Hiện ông Danh đang nắm giữ hơn 4 triệu cổ phiếu PDR, chiếm 0,46% vốn.
Động thái muốn giảm sở hữu của lãnh đạo và người nhà lãnh đạo PDR diễn ra trong bối cảnh thị giá PDR đang điều chỉnh mạnh. Chốt phiên 22/7, cổ phiếu PDR dừng ở mức 20.100 đồng/cổ phiếu, giảm hơn 33% so với đỉnh ngắn hạn hồi đầu tháng 4.
Về tình hình kinh doanh, báo cáo tài chính quý 2/2024 của Phát Đạt cho biết doanh thu thuần đạt 8,5 tỷ đồng, cao gấp gần 4 lần cùng kỳ năm trước. Doanh thu hoạt động tài chính đạt mức 202 tỷ đồng, giảm 62% so với cùng kỳ năm trước. Khoản mục này của Phát Đạt phần lớn đến từ việc chuyển nhượng cổ phần công ty liên kết, cụ thể là công ty BIDICI.
Hồi cuối tháng 6, HĐQT đã thông qua việc chuyển nhượng toàn bộ 111,7 triệu cổ phần (tương đương 49% vốn điều lệ) đang nắm giữ tại CTCP Đầu tư Bất động sản BIDICI. Giá trị theo mệnh giá là hơn 1.117 tỷ đồng và giá chuyển nhượng không thấp hơn 130% mệnh giá. Ngày 24/6, Phát Đạt mới chuyển nhượng 25% vốn tại BIDICI cho ông Nguyễn Trà Giang với giá 769,5 tỷ đồng, hạ sở hữu từ 49% xuống còn 24% vốn.
Kết quả, Phát Đạt mang về 87 tỷ đồng lãi trước thuế, giảm 77% so với thực hiện năm trước. Lợi nhuận sau thuế của cổ đông công ty mẹ đạt 49,7 tỷ đồng, giảm 82% so với cùng kỳ. EPS giảm từ 411 đồng về còn 64 đồng.
Lũy kế 6 tháng, Phát Đạt đạt tổng cộng 170 tỷ đồng doanh thu, 102 tỷ đồng lợi nhuận ròng, lần lượt giảm 13% và 65% so với thực hiện năm trước."
146,19/07/2024 15:40,"Phát Đạt (PDR): Doanh thu quý 2/2024 chỉ hơn 8 tỷ đồng, “cứu” lợi nhuận nhờ bán công ty liên kết cho “người quen cũ”",https://cafef.vn/phat-dat-pdr-doanh-thu-quy-22024-chi-hon-8-ty-dong-cuu-loi-nhuan-nho-ban-cong-ty-lien-ket-cho-nguoi-quen-cu-188240719152303809.chn?utm_source=du-lieu.chn,"CTCP Phát triển Bất động sản Phát Đạt (mã chứng khoán: PDR) vừa công bố BCTC quý 2/2024 với doanh thu thuần chỉ 8,5 tỷ đồng nhưng cũng là con số cao gấp gần 4 lần cùng kỳ năm trước. Sau khi trừ giá vốn, doanh nghiệp này lãi gộp 1,7 tỷ đồng.
Doanh thu hoạt động tài chính đạt mức 202 tỷ đồng, giảm 62% so với cùng kỳ năm trước. Khoản mục này của Phát Đạt phần lớn đến từ việc chuyển nhượng cổ phần công ty liên kết, cụ thể là công ty BIDICI.
Hồi cuối tháng 6, HĐQT đã thông qua việc chuyển nhượng toàn bộ 111,7 triệu cổ phần (tương đương 49% vốn điều lệ) đang nắm giữ tại CTCP Đầu tư Bất động sản BIDICI. Giá trị theo mệnh giá là hơn 1.117 tỷ đồng và giá chuyển nhượng không thấp hơn 130% mệnh giá.
BCTC quý 2/2024 cho biết, ngày 24/6, Phát Đạt mới chuyển nhượng 25% vốn tại BIDICI cho ông Nguyễn Trà Giang với giá 769,5 tỷ đồng, hạ sở hữu từ 49% xuống còn 24% vốn.
Ngoài việc bán công ty liên kết, chi phí tài chính của Phát Đạt cũng đã giảm 31% còn gần 73 tỷ đồng. Các chi phí khác của công ty này gần như không đổi.
Kết quả, Phát Đạt mang về 87 tỷ đồng lãi trước thuế, giảm 77% so với thực hiện năm trước. Lợi nhuận sau thuế của cổ đông công ty mẹ đạt 49,7 tỷ đồng, giảm 82% so với cùng kỳ. EPS giảm từ 411 đồng về còn 64 đồng.
Lũy kế 6 tháng, Phát Đạt đạt tổng cộng 170 tỷ đồng doanh thu, 102 tỷ đồng lợi nhuận ròng, lần lượt giảm 13% và 65% so với thực hiện năm trước.
Tại thời điểm 30/6/2024, tổng tài sản của doanh nghiệp đạt 22.536 tỷ đồng, tăng 1.500 tỷ so với số đầu năm. Trong đó, hàng tồn kho chiếm hơn một nửa tài sản, đạt mức 12.523 tỷ đồng. Đây chủ yếu các bất động sản đang xây dựng dở dang. Các khoản phải thu ngắn hạn ở mức 5.078 tỷ đồng, lượng tiền mặt và tiền gửi tăng gấp đôi đạt mức 1.190 tỷ đồng.
Nợ vay tài chính của Phát Đạt ở mức 4.183 tỷ đồng. Vốn chủ sở hữu đạt 11.004 tỷ đồng, trong đó lợi nhuận sau thuế chưa phân phối ở mức hơn 1.900 tỷ đồng."
