Unnamed: 0,Thời gian,Tiêu đề,URL,content
205,03/05/2024 09:20,"Chủ tịch Phát Đạt nói gì về việc TP.HCM thu hồi dự án nằm ở khu ""đất vàng"" được bao bọc 4 mặt tiền ở Quận 3?",https://cafef.vn/chu-tich-phat-dat-noi-gi-ve-viec-tphcm-thu-hoi-du-an-nam-o-khu-dat-vang-duoc-bao-boc-4-mat-tien-o-quan-3-188240503083919993.chn?utm_source=du-lieu.chn,"Mới đây, Chủ tịch UBND TP.HCM đã chủ trì cuộc họp Tổ công tác giải quyết vướng mắc liên quan đến dự án Nhà thi đấu Phan Đình Phùng (số 8 Võ Văn Tần, quận 3, TP.HCM) do CTCP Phát triển Bất động sản Phát Đạt (Mã: PDR) làm chủ đầu tư..
Sau khi nghe báo cáo của Sở Kế hoạch và Đầu tư (Tổ trưởng Tổ công tác), ý kiến của Phó Chủ tịch UBND TP.HCM Dương Anh Đức, Sở Văn hóa và Thể thao và đại diện thành viên tổ công tác, Chủ tịch UBND TP.HCM thống nhất đề xuất dừng đầu tư dự án Nhà thi đấu Phan Đình Phùng theo hình thức đối tác công tư (hợp đồng BT). Đồng thời, chuyển dự án này sang phương thức đầu tư công.
Trước đó, tại ĐHĐCĐ của công ty Phát Đạt, trả lời câu hỏi cổ đông về tình hình dự án nhà thi đấu Phan Đình Phùng tại TP.HCM, ông Nguyễn Văn Đạt, Chủ tịch HĐQT Phát Đạt cho hay với vai trò là doanh nghiệp bất động sản, Phát Đạt hoàn toàn tuân thủ theo quy định của pháp luật. Tuy nhiên, ông Đạt cho hay doanh nghiệp này vẫn mong muốn phát triển tiếp dự án.
""Tôi muốn khẳng định hai điều, thứ nhất là nhà đầu tư vẫn muốn làm tiếp. Thứ hai là theo quy định thì dự án Phan Đình Phùng vẫn được tiếp tục chuyển tiếp, nhưng tuân thủ quy định pháp luật nên chúng ta chờ để làm việc với các cơ quan chức năng"", ông Đạt khẳng định.
Nhà thi đấu Phan Đình Phùng nằm ngay khu đất ""vàng"" được bao bọc bởi 4 mặt tiền đường Pasteur - Nguyễn Đình Chiểu - Nam Kỳ Khởi Nghĩa - Võ Văn Tần (quận 3, TP.HCM).
Dự án được Thủ tướng chấp thuận chủ trương đầu tư theo hình thức BT (xây dựng - chuyển giao) từ năm 2008 và bắt đầu triển khai từ tháng 3/2010.
Ban đầu, dự án có mức đầu tư là 988 tỷ đồng, với thiết kế 7 tầng nổi và 3 tầng hầm, xây dựng trên khu đất hơn 14.400 m2, trong đó diện tích xây dựng là hơn 7.100 m2. Theo hợp đồng, thành phố thanh toán khu đất khu đất 257 Trần Hưng Đạo ở trung tâm quận 1 cho nhà đầu tư.
Tuy nhiên, năm 2013, dự án có phương án thiết kế mới, khái toán tổng mức đầu tư lúc này tăng lên gần 1.353 tỷ đồng và UBND TP.HCM xin bổ sung thêm khu đất tại 3-3 Bis Phan Văn Đạt (quận 1) để thanh toán cho nhà đầu tư.
Đến năm 2016, vốn đầu tư khả thi của dự án lên tới hơn 1.953 tỷ đồng, tăng gấp đôi so với ban đầu. Thành phố tiếp tục xin bổ sung thêm khu đất 3 ha ở khu trường đua Phú Thọ để thanh toán hợp đồng.
Hiện, các khu đất được đề xuất để thanh toán hợp đồng BT cho dự án nhà thi đấu Phan Đình Phùng gồm các lô ở 257 Trần Hưng Đạo, Phan Văn Đạt, 181 Điện Biên Phủ (quận Bình Thạnh) và số 72/2B Võ Văn Ngân (TP Thủ Đức).
Ngoài khu đất ở đường Trần Hưng Đạo đã được Thủ tướng phê duyệt để thanh toán cho dự án, các khu còn lại đều cần phải có ý kiến của Ban chỉ đạo 167 về sắp xếp lại nhà, đất công.
Tại báo cáo tài chính hợp nhất quý 1/2024, Phát Đạt đã chi 77,1 tỷ đồng vào chi phí xây dựng cơ bản dở dang đối với dự án Nhà thi đấu Phan Đình Phùng. So với thời điểm tháng 12/2023, chi phí này vẫn được giữ nguyên."
206,03/05/2024 00:00,"PDR: 10.5.2024, ngày GDKHQ bán ưu đãi (tỷ lệ 5,5:1)",https://cafef.vn/du-lieu/PDR-1989695/pdr-1052024-ngay-gdkhq-ban-uu-dai-ty-le-551.chn?utm_source=du-lieu.chn,
207,03/05/2024 00:00,PDR: Bản cáo bạch chào bán thêm cổ phiếu ra công chúng,https://cafef.vn/du-lieu/PDR-2012561/pdr-ban-cao-bach-chao-ban-them-co-phieu-ra-cong-chung.chn?utm_source=du-lieu.chn,
208,02/05/2024 00:00,PDR: Nghị quyết và Biên bản họp ĐHĐCĐ thường niên năm 2024,https://cafef.vn/du-lieu/PDR-1986171/pdr-nghi-quyet-va-bien-ban-hop-dhdcd-thuong-nien-nam-2024.chn?utm_source=du-lieu.chn,
209,02/05/2024 00:00,PDR: Thông báo chào bán cổ phiếu ra công chúng,https://cafef.vn/du-lieu/PDR-1986614/pdr-thong-bao-chao-ban-co-phieu-ra-cong-chung.chn?utm_source=du-lieu.chn,
210,02/05/2024 00:00,PDR: Đính chính về việc thay đổi nội dung Biên bản họp ĐHĐCĐ số 01 ngày 26/04/2024,https://cafef.vn/du-lieu/PDR-2010314/pdr-dinh-chinh-ve-viec-thay-doi-noi-dung-bien-ban-hop-dhdcd-so-01-ngay-26042024.chn?utm_source=du-lieu.chn,
211,02/05/2024 00:00,"PDR: Điều lệ công ty sửa đổi và Quy chế nội bộ về QTCT, Quy chế hoạt động của HĐQT",https://cafef.vn/du-lieu/PDR-2010318/pdr-dieu-le-cong-ty-sua-doi-va-quy-che-noi-bo-ve-qtct-quy-che-hoat-dong-cua-hdqt.chn?utm_source=du-lieu.chn,
212,26/04/2024 13:33,"ĐHĐCĐ Phát Đạt (PDR): Tiền mặt còn vỏn vẹn 19 tỷ đồng sau “cơn bĩ cực” trái phiếu, sắp phát hành lượng lớn cổ phiếu",https://cafef.vn/dhdcd-phat-dat-pdr-tien-mat-con-von-ven-19-ty-dong-sau-con-bi-cuc-trai-phieu-sap-phat-hanh-luong-lon-co-phieu-188240426114629473.chn?utm_source=du-lieu.chn,"Sáng ngày 26/4/2024, CTCP Phát triển BĐS Phát Đạt (PDR) đã tổ chức ĐHĐCĐ thường niên, thông qua kế hoạch doanh thu 2.982 tỷ - giảm 6% và lợi nhuận sau thuế 880 tỷ đồng - tăng 29% so với năm 2023.
Với chỉ tiêu trên, PDR dự chia tỷ lệ chia cổ tức 2024 bằng cổ phiếu tối thiểu 92% lợi nhuận sau thuế. ĐHĐCĐ ủy quyền cho HĐQT xem xét, điều chỉnh mục tiêu kinh doanh phù hợp với tình hình thị trường bất động sản và tình hình hoạt động kinh doanh thực tế của công ty.
Trong quý đầu năm, Công ty đạt hơn 162 tỷ đồng doanh thu thuần từ chuyển nhượng căn hộ - giảm 16% và gần 53 tỷ đồng lãi ròng – cao gấp 2,2 lần về lợi nhuận so với cùng kỳ năm ngoái.
Theo đánh giá của HĐQT, nhu cầu và tiêu chuẩn đối với sản phẩm bất động sản tại Việt Nam đang thay đổi rất nhiều sau giai đoạn xáo trộn vừa qua. PDR dự kiến sẽ tập trung vào nhu cầu nhà ở của nhóm khách hàng thế hệ mới ở các đô thị đang phát triển. Cụ thể,
+ Tại thị trường Bình Dương: PDR ưu tiên mô hình sản phẩm căn hộ có diện tích phù hợp để phát triển dự án Khu phức hợp Thuận An 1 và 2.
+ Đối với khu vực đang phát triển của Bình Định: Công ty tập trung vào sản phẩm đất nền nhà phố - biệt thự có diện tích vừa cho dự án Khu đô thị Bắc Hà Thanh.
+ Còn tại các địa phương gắn liền với lợi thế du lịch - nghỉ dưỡng: Công ty phát triển các mô hình sản phẩm căn hộ du lịch biển và khách sạn cao cấp cho dự án Cadia Quy Nhơn, Bình Định; căn hộ - biệt thự nghỉ dưỡng cho dự án Poulo Condor tại Côn Đảo và Serenity Phước Hải tại Bà Rịa - Vũng Tàu.
Công ty đã có kế hoạch mở bán 6 dự án: Thuận An (Bình Dương), Bắc Hà Thanh (Bình Định), Cadia (Quy Nhơn, Bình Định), Poulo Condor (Côn Đảo), Hàn Riverside (Đà Nẵng), Serenity Phước Hải (Bà Rịa - Vũng Tàu).
VỪA QUA ""CƠN BĨ CỰC""
Chia sẻ tại Đại hội, ông Nguyễn Văn Đạt, Chủ tịch HĐQT nói: ""Chúng ta trải qua năm 2023 rất khó khăn, cả về kinh tế vĩ mô và ngành. PDR lãi 682 tỷ, hoàn thành kế hoạch kinh doanh. Giá cổ phiếu PDR từ cuối năm 2022 đến cuối năm 2023 tăng gấp đôi. Số lượng cổ đông cũng tăng gấp đôi lên hơn 32.000 người"".
Theo ông Đạt, thách thức lớn nhất của các công ty bất động sản trong năm 2023 là vấn đề trái phiếu, và điểm sáng 2023 là Công ty đã tất toán hết toàn bộ trái phiếu.
Cần biết, giai đoạn 2019-2021, PDR là một trong những ""tay chơi"" trái phiếu nổi trội trên thị trường. ""Cơn say"" trái phiếu khiến Công ty ""trả giá"" không hề rẻ. Cổ phiếu liên tục bị bán tháo và giảm sàn, tài sản lãnh đạo bị force sell… là những hệ luỵ năm 2022. Trong cơn bĩ cực, ông Đạt từng chia sẻ phải bán rẻ tài sản để xoay tiền.
Năm 2023, PDR cũng phát hành cổ phiếu riêng lẻ để huy động gần 672 tỷ đồng. Song song, Công ty c ũng chuyển nhượng 99,8% vốn tại CTCP Đầu tư và Phát triển Khu công nghiệp Phát Đạt (PDI) với lợi nhuận 415 tỷ đồng; chuyển nhượng một phần quyền sở hữu tại CTCP Bất động sản Commonwealth Properties.
SẮP PHÁT HÀNH LƯỢNG CỔ PHIẾU ""KHỦNG""
Sang năm nay, PDR quay lại đẩy mạnh việc huy động qua phát hành cổ phiếu với khối lượng tương đối lớn. Bao gồm:
Thứ nhất, HĐQT đã thông qua phương án chào bán hơn 134 triệu cổ phiếu cho cổ đông hiện hữu với giá 10.000 đồng/cp. Thời gian thực hiện dự kiến trong quý 2/2024.
Thứ hai, đáng chú ý, Công ty cũng dự kiến phát hành hơn 34 triệu cổ phiếu với giá 20.000 đồng/cp (1 cổ phiếu sẽ được hoán đối 20.000 đồng nợ) để hoán đổi khoản nợ 30 triệu USD. Đây là khoản nợ bằng đồng USD, được Phát Đạt vay từ ACA Vietnam Real Estate III LP (Cayman Island) vào tháng 3/2022, với lãi suất cố định 8%/năm. Mục đích vay để đầu tư cho dự án Phước Hải (huyện Đất Đỏ, tỉnh Bà Rịa - Vũng Tàu).
Sau hai năm kể từ ngày giải ngân, khoản vay này sẽ được hoán đổi thành cổ phiếu phổ thông cho bên cho vay. Theo phương án vay vốn ban đầu, giá hoán đổi được tính bằng 135% mức giá bình quân gia quyền đóng cửa của cổ phiếu PDR trong 20 ngày giao dịch tính đến ngày 11/3/2022 là 119.879 đồng/cp. Tỷ giá mua vào USD của Vietcombank tại ngày này là 22.730 VND/USD.
Thứ ba, Công ty dự kiến phát hành tối đa 131 triệu cổ phiếu để trả cổ tức 2023 với tỷ lệ 15% (cổ đông sở hữu 100 cổ phiếu sẽ được nhận 15 cổ phiếu mới).
PDR cũng có kế hoạch phát hành tối thiểu 14,6 triệu cổ phiếu ESOP với giá 12.000 đồng/cp cho thành viên HĐQT, ban cố vấn, ban tổng giám đốc, các cấp quản lý và người lao động có thành tích đóng góp vào sự phát triển của công ty, có năng lực và cam kết đồng hành lâu dài cùng công ty. Cổ phiếu này sẽ bị hạn chế chuyển nhượng một năm. Tiền huy động được từ phát hành ESOP sẽ bổ sung vào vốn phục vụ hoạt động sản xuất kinh doanh.
Thời gian thực hiện các đợt phát hành dự kiến diễn ra trong năm 2024, thời gian cụ thể sẽ do HĐQT quyết định và ngay sau khi có sự chấp thuận bằng văn bản của UBCKNN.
Thảo luận tại Đại hội
1. Về việc chuyển đổi nợ thành cổ phiếu với giá 20.000 đồng/cp, quỹ ACA này là ai, giá chuyển đổi này có phù hợp trong thời gian hiện tại không? Việc phát hành thêm để huy động vốn nhằm mục đích gì?
Chủ tịch Nguyễn Văn Đạt: Quỹ ACA làm việc với PDR 2 năm, có gốc các doanh nghiệp Nhật rất lớn, không những cho vay mà có những bước đi dò xét trước khi đầu tư vào PDR. Quan điểm kinh doanh của PDR là win-win cùng kiếm tiền. Giá chuyển đổi trong hợp đồng trước đây rất cao nhưng thời điểm rồi giá cổ phiếu rớt xuống nên tôi nghĩ 20.000 đồng là hợp lý. Sau các đợt phát hành tới, gồm chia cổ tức thì mức giá cân bằng. Chúng tôi muốn mời nhà đầu tư Nhật vào ở những bước đầu tiên, làm tiền đề mời thêm nhiều nhà đầu tư lớn.
Vốn huy động được cho các dự án tạo dòng tiền nhanh trong năm nay như Cadia (Quy Nhơn), Bắc Hà Thanh, Nguyễn Thị Minh Khai (Bình Dương) và hoàn tất hạ tầng dự án 249 Bình Định.
2. Dự trù kết quả kinh doanh 2-3 năm tới? Doanh thu bao nhiêu tỷ USD khi triển khai hết quỹ đất?
Chủ tịch Nguyễn Văn Đạt: Mỗi năm tăng trưởng lợi nhuận trên 20% trong 3 năm tới. Quỹ đất hiện nay gồm đang sở hữu và đang theo đuổi, từng giai đoạn tùy tình hình thị trường mà chúng tôi đưa sản phẩm ra thị trường chứ không thể bán hết cùng lúc hơn 4.000 ha này.
Ngoài quỹ đất này, chúng ta đang mua thêm quỹ đất mới.
Ông Bùi Quang Anh Vũ, Tổng Giám đốc: Mỗi chu kỳ 5 năm, PDR đều có kế hoạch. Chúng ta đã có số liệu 2019 – 2023, do biến động thị trường, H ĐQT đang xây dựng kế hoạch 2024 2028 và sẽ công bố trong thời gian tới.
3. PDR có kế hoạch đầu tư KCN lại không? Tiến độ dự án Phan Đình Phùng?
Chủ tịch Nguyễn Văn Đạt: Vừa rồi chúng ta tái cơ cấu tài chính, bán mảng KCN nhưng vẫn còn những tờ trình xin KCN ở các địa phương, nếu đấu thầu được thì vẫn tiếp tục làm. Hiện đã được một KCN hơn 400 ha ở Quảng Ngãi và đang có cơ hội ở nhiều tỉnh thành khác.
Nhà thi đấu Phan Đình Phùng, Tp.HCM muốn thu hồi lại, chúng tôi hoàn toàn tuân thủ pháp lý. Về mong muốn, chúng tôi vẫn muốn làm tiếp và đủ pháp lý để làm tiếp.
4. Cơ sở hoàn thành lợi nhuận 2024, dự án nào đóng góp trọng tâm, quý nào lợi nhuận cao?
Chủ tịch Nguyễn Văn Đạt: Chúng ta có 4 - 6 dự án ra trong năm với tổng giá trị sản phẩm 30.000 - 40.000 tỷ đồng. Dự án Bắc hà thanh đang xây dựng ráo riết, nếu không có gì thay đổi thì tháng 5-6 này sẽ hoàn tất đóng tiền sử dụng đất, cuối quý II sẽ bắt đầu bán hàng và ghi nhận lợi nhuận hai quý cuối năm. Doanh nghiệp bất động sản ghi nhận lãi ở quý IV là lớn nhất.
5. Dự án Thuận An 1 có giấy phép xây dựng chưa? Tiến độ chuyển nhượng hai dự án EverRich và có ý định chấm dứt hợp đồng không?
Chủ tịch Nguyễn văn Đạt: Thuận An 1 đã có giấy phép xây dựng phần thân, Thuận An 2 có giấy phép xây dựng phần cọc. Dự án xây dựng theo phân kỳ đầu tư nhiều giai đoạn nên không lo lắm về vốn.
Hai dự án EverRich đã chuyển nhượng hoàn tất, đã thu đủ tiền, không còn quyền lợi và trách nhiệm.
6. Đại diện HSC: PDR có kế hoạch chuyển đổi mô hình bán hàng, vậy định hướng tổ chức bán hàng có thay đổi gì so với quá khứ?
Chủ tịch Nguyễn Văn Đạt: Quá khứ, PDR từng bán sỉ sản phẩm, nhiều nhà đầu tư hiểu nhầm chuyển nhượng dự án. Thời gian qua PDR bán sỉ cho Danh Khôi, đối tác khó khăn dù họ rất cố gắng trả nợ cho mình.
Lúc thị trường tốt thì không có vấn đề gì, lúc thị trường xấu có một số ít lợi dụng đám đông gây ảnh hưởng đến mình.
PDR đã phối hợp với một doanh nghiệp thay thế Danh Khôi, dự kiến ký hợp đồng trong tháng 5 tới. Công ty này đồng ý cho PDR kiểm soát tài chính chặt chẽ. Chúng ta chia sẻ lợi nhuận và chia sẻ rủi ro.
TIỀN MẶT CHỈ CÒN 19 TỶ
7. Lãi quý 1 đến từ đâu? Tiền mặt còn hơn 19 tỷ - rất ít, liệu có ảnh hưởng gì đến hoạt động công ty không?
Ông Bùi Quang Anh Vũ, Tổng Giám đốc: Khoản thu khác trong quý 1 gồm tiền phạt từ Danh Khôi và một số hoạt động khác của công ty.
Chủ tịch Nguyễn Văn Đạt: Tôi khẳng định 19 tỷ không ảnh hưởng bất cứ hoạt động nào của PDR.
Ông Lê Quang Phúc, Thành viên HĐQT: Số liệu tại ngày 31/3/2024 là số ngày chốt sổ còn dòng tiền vẫn vận động nên sẽ không ảnh hưởng đến hoạt động của công ty.
8. Trong số liệu dự phóng 30.000 - 40.000 tỷ, công ty dự trù được bao nhiêu lợi nhuận và sẽ phân phối trong mấy năm?
Chủ tịch Nguyễn Văn Đạt: Cần làm rõ 30.000 - 40.000 tỷ đồng này là tổng giá trị sản phẩm của 4 - 6 dự án chứ không phải ghi nhận một lần trong một năm. Kế hoạch đã có chi tiết nhưng vì quyền lợi của chúng ta nên chưa thể chia sẻ ngay được, phải giữ kín một chút, còn ở bước tính tiền sử dụng đất.
Ông Lê Quang Phúc, Thành viên HĐQT: Doanh số bán hàng 40.000 tỷ đồng nhưng doanh thu mỗi năm bao nhiêu, đến từ dự án nào chúng ta chờ thêm thời gian vì số liệu sẽ ảnh hưởng nhiều đầu công việc còn đang dang dở.
9. Ban lãnh đạo chia sẻ đơn vị tài chính nào hỗ trợ cho việc mở bán ngày 12/5 sắp tới bởi điều này giúp chúng tôi dự đoán được khách hàng có mua dự án được tốt không?
Chủ tịch Nguyễn Văn Đạt: Ngày 12/5 tới là ký kết hợp tác toàn diện và cam kết mua lại toàn bộ chứ PDR chưa được mở bán vì chưa có giấy phép mở bán. Hai dự án này được MB tài trợ cho chủ đầu tư, cho khách hàng."
213,25/04/2024 00:00,PDR: Quyết định của HĐQT về việc thông qua ngày ĐKCC để thực hiện quyền mua cổ phiếu,https://cafef.vn/du-lieu/PDR-1983134/pdr-quyet-dinh-cua-hdqt-ve-viec-thong-qua-ngay-dkcc-de-thuc-hien-quyen-mua-co-phieu.chn?utm_source=du-lieu.chn,
214,24/04/2024 15:51,Phát Đạt (PDR) sắp thu về hơn 1.340 tỷ đồng từ việc chào bán cổ phiếu để triển khai loạt dự án bất động sản,https://cafef.vn/phat-dat-pdr-sap-thu-ve-hon-1340-ty-dong-tu-viec-chao-ban-co-phieu-de-trien-khai-loat-du-an-bat-dong-san-188240424153951752.chn?utm_source=du-lieu.chn,"Ngày 23/4, Ủy ban Chứng khoán Nhà nước (UBCKNN) đã trao giấy chứng nhận đăng ký chào bán cổ phiếu ra công chúng cho CTCP Phát triển Bất động sản Phát Đạt (HoSE: PDR).
Cụ thể, Phát Đạt sẽ chào bán 134,3 triệu cổ phiếu, giá 10.000 đồng/cp cho cổ đông hiện hữu. Tỷ lệ thực hiện 1:5,5. Tức mỗi cổ đông tại thời điểm chốt danh sách nắm giữ 5,5 cổ phiếu sẽ được hưởng 5,5 quyền mua, tương đương được mua 1 cổ phiếu chào bán thêm. Thời gian phân phối trong 90 ngày kể từ ngày 23/4.
Số tiền huy động dự kiến là 1.343,3 tỷ đồng. Toàn bộ số tiền thu về sẽ được sử dụng để triển khai các dự án bất động sản của công ty và công ty con, như: Dự án Khu dân cư Bắc Hà Thanh (dự kiến chi 511 tỷ đồng), Dự án Cadia Quy Nhơn (dự kiến chi 400 tỷ đồng), Dự án Thuận An 1 và Thuận An 2 (dự kiến chi 300 tỷ đồng).
Trong năm ngoái, Phát Đạt đã huy động thành công hơn 670 tỷ đồng thông qua việc chào bán 67 triệu cổ phiếu riêng lẻ giá 10.000 đồng/cổ phiếu cho nhà đầu tư chứng khoán chuyên nghiệp. Qua đó, góp phần giúp doanh nghiệp này đưa dư nợ vay trái phiếu về 0 vào cuối năm 2023.
Việc xử lý dứt điểm nợ trái phiếu đã giúp tỷ lệ nợ vay ngắn & dài hạn/vốn chủ sở hữu của Bất động sản Phát Đạt trong năm 2023 sẽ chỉ còn khoảng 0,22 lần - thấp hơn đáng kể so với mặt bằng chung của ngành bất động sản Việt Nam hiện nay.
Năm 2024, Phát Đạt còn dự định phát hành 34,1 triệu cổ phiếu giá 20.000 đồng để hoán đổi khoản nợ vay 30 triệu USD tại ACA Vietnam Real Estate III LP và 14,6 triệu cổ phiếu giá 12.000 đồng cho cán bộ nhân viên.
Về tình hình kinh doanh quý 1/2024, Phát Đạt ghi nhận doanh thu thuần đạt 162 tỷ đồng, lợi nhuận sau thuế tăng gấp 2,3 lần so với cùng kỳ đạt 52,3 tỷ đồng."
215,24/04/2024 00:00,PDR: Thông báo nhận được giấy chứng nhận đăng ký chào bán cổ phiếu ra công chúng,https://cafef.vn/du-lieu/PDR-1983062/pdr-thong-bao-nhan-duoc-giay-chung-nhan-dang-ky-chao-ban-co-phieu-ra-cong-chung.chn?utm_source=du-lieu.chn,
216,24/04/2024 00:00,PDR: Ông Lê Quang Phúc - thành viên HĐQT đăng ký bán 2.062.185 cp,https://cafef.vn/du-lieu/PDR-1983083/pdr-ong-le-quang-phuc-thanh-vien-hdqt-dang-ky-ban-2062185-cp.chn?utm_source=du-lieu.chn,
217,19/04/2024 14:14,Phát Đạt tăng gấp đôi lợi nhuận trong quý 1/2024,https://cafef.vn/phat-dat-tang-gap-doi-loi-nhuan-trong-quy-12024-188240419141320921.chn?utm_source=du-lieu.chn,"CTCP Phát triển Bất động sản Phát Đạt (mã chứng khoán: PDR) vừa công bố báo cáo tài chính quý 1/2024 với doanh thu thuần đạt 162 tỷ đồng, giảm 15,6% so với cùng kỳ. Với giá vốn hàng bán và dịch vụ cung cấp chỉ chưa tới 1 tỷ đồng nên lợi nhuận gộp của PDR đạt 161 tỷ đồng.
Trong kỳ vừa qua, Phát Đạt ghi nhận lợi nhuận sau thuế tăng gấp 2,3 lần so với cùng kỳ đạt 52,3 tỷ đồng.
Tại thời điểm 31/3/2024, hàng tồn kho của PDR đạt 12.302 tỷ đồng, trong đó chủ yếu đến từ dự án The EverRich 2, dự án Thuận An 1, Thuận An 2, dự án Phước Hải và dự án The EverRich 3. Tổng tài sản của PDR trong kỳ tăng nhẹ lên 21.428 tỷ đồng.
Trước đó, chia sẻ về định hướng kinh doanh năm 2024, ông Bùi Quang Anh Vũ, Tổng giám đốc của Phát Đạt, cho biết, Phát Đạt sẽ tập trung mọi nguồn lực, đặc biệt là nguồn lực tài chính và nhân sự, quyết tâm đẩy mạnh hoạt động bán hàng nhằm kỳ vọng đạt được mục tiêu lớn về dòng tiền. Theo kế hoạch, Phát Đạt sẽ đưa ra thị trường 4 dự án trọng điểm tại Bình Dương, Côn Đảo, Bình Định.
Đồng thời, Phát Đạt xác lập định hướng rõ ràng trong việc phát triển sản phẩm, trong đó chú trọng đến các yếu tố như: Vị trí giao thông thuận lợi, tập trung vào các thị trường có tiềm năng, có sẵn động lực tăng trưởng kinh tế – xã hội – du lịch –xe thương mại, cũng như tại các thị trường có nhu cầu tiêu thụ sản phẩm cao. Dự kiến, các dự án này sẽ mang về doanh thu khoảng 40.000 tỷ đồng trong năm nay. Nhìn nhận về triển vọng 2024, ông Vũ bày tỏ niềm tin với chu kỳ mới của nền kinh tế, bất động sản vẫn là kênh đầu tư tốt. Tuy nhiên, thị trường cũng cần sự quản lý, định hướng, bền vững để mang đến lợi ích cho nhiều người.
""Thị trường bất động sản năm 2024 vẫn còn dè dặt. Do đó, các doanh nghiệp có tính sẵn sàng cao sẽ khôi phục niềm tin trở lại cho các nhà đầu tư. Đối với Phát Đạt, doanh nghiệp xác định luôn chủ động tìm cơ hội mới để góp phần thúc đẩy sinh khí chung của toàn ngành”, CEO Phát Đạt chia sẻ."
218,19/04/2024 00:00,PDR: Giải trình biến động kết quả kinh doanh quý 1/2024 so với quý 1/2023,https://cafef.vn/du-lieu/PDR-1979677/pdr-giai-trinh-bien-dong-ket-qua-kinh-doanh-quy-12024-so-voi-quy-12023.chn?utm_source=du-lieu.chn,
