Unnamed: 0,Thời gian,Tiêu đề,URL,content
24,13/08/2025 10:00,VN-Index chạm 1.600 điểm: Định giá nhóm chứng khoán ở mức nào?,https://cafef.vn/vnindex-cham-1600-diem-dinh-gia-nhom-chung-khoan-o-muc-nao-188250813092724213.chn?utm_source=du-lieu.chn,"Định giá phân hoá
Thị trường chứng khoán Việt Nam đang trải qua giai đoạn giao dịch hưng phấn với chỉ số VN-Index xác lập kỷ lục mới, trong khi thanh khoản bùng nổ. Mới đây nhất, ngay trong phiên giao dịch đầu tuần 11/8, VN-Index lần đầu tiên trong lịch sử chạm mốc tâm lý 1.600 điểm. Dù không giữ được mốc này tới cuối phiên và đóng cửa ở 1.596,86 điểm, nhưng tính từ đầu năm tới nay, VN-Index vẫn tăng 25,77%. Trong 25 năm hình thành và phát triển của thị trường chứng khoán Việt Nam đây là mốc cao nhất mọi thời đại.
Bên cạnh đó, dòng tiền đổ vào thị trường chứng khoán với các phiên khớp lệnh tỷ USD ngày càng nhiều. Thậm chí, những ngày gần đây, thanh khoản toàn thị trường thường xuyên giao dịch ở mức 2 tỷ USD/phiên, trong đó có phiên giao dịch kỷ lục ngày 5/8 với giá trị khớp lệnh liên tục lên tới 86.000 tỷ đồng.
Vốn hóa thị trường tăng vượt bậc một phần đến từ sự tăng trưởng mạnh mẽ của một số dòng cổ phiếu mang tính dẫn dắt trên thị trường như: VIC, SHB, CTG, SSI, VIX,….
Xét về định giá thị trường, VN-Index đã tăng hơn 25% từ đầu năm nhưng P/E chỉ ở mức 14,4 lần - ngang mức trung bình giai đoạn 3 - 5 năm gần đây và còn cách khá xa các đỉnh nóng năm 2018 khi P/E khoảng 22 lần hay năm 2021 với P/E khoảng 18 lần.
Cùng với nhịp tăng tích cực trong giai đoạn gần đây, định giá cổ phiếu của các công ty chứng khoán cũng có sự thay đổi đáng kể. Theo thống kê, P/B trung bình của nhóm chứng khoán ước tính vào khoảng 2 lần, trong khi chỉ số P/E trung bình vào khoảng 23 lần. Con số này đã cao hơn khá nhiều so với mức trung bình 5 năm gần đây. Tuy nhiên, không phải cổ phiếu chứng khoán nào cũng đang ở mức định giá cao.
Định giá P/E (Price to Earnings Ratio - Hệ số giá trên lợi nhuận) là một chỉ số tài chính được dùng phổ biến để định giá cổ phiếu, phản ánh mối tương quan giữa giá thị trường của cổ phiếu và lợi nhuận trên mỗi cổ phiếu (EPS) của doanh nghiệp.
P/E cao đồng nghĩa với việc nhà đầu tư sẵn sàng trả giá cao hơn cho mỗi đồng lợi nhuận của doanh nghiệp, thường xuất hiện ở doanh nghiệp có tiềm năng tăng trưởng mạnh hoặc ngành đang ""hot"". Tuy nhiên, P/E quá cao cũng có thể hàm ý cổ phiếu đang bị định giá quá mức.
Trong khi đó, doanh nghiệp có chỉ số P/E thấp ở một thời điểm có thể do doanh nghiệp hoạt động hiệu quả hơn so với thời gian trước. Vì thế, lợi nhuận trên 1 cổ phần (EPS) tăng lên, khiến cho P/E thấp. Trong trường hợp này có thể nói cổ phiếu đang bị định giá thấp và là cơ hội để mua vào.
Nhìn lại PE của nhóm các cổ phiếu chứng khoán thời điểm hiện tại, so với mức trung bình ngành là 23 lần, vẫn còn những cổ phiếu đang được định giá ""rẻ"".
Top 10 CTCK vốn hóa lớn nhất thị trường (tại ngày gần nhất 11/08/2025) (Nguồn: Dựa trên BCTC các CTCK)
Với mức lợi nhuận ấn tượng trong quý II/2025, VIX nằm trong nhóm có P/E thấp nhất ngành (khoảng 21 lần). Trong quý vừa qua, VIX ghi nhận lợi nhuận sau thuế 1.301,6 tỷ đồng, tăng trưởng hơn 10 lần so với cùng kỳ năm trước. Luỹ kế nửa đầu năm, lợi nhuận sau thuế của Công ty đạt 1.673,8 tỷ đồng, tăng 5,8 lần so với cùng kỳ.
Thị trường chứng khoán thuận lợi đã giúp các mảng doanh thu của VIX tăng mạnh, đặc biệt là tự doanh. Lãi từ các tài sản tài chính ghi nhận thông qua lãi/lỗ (FVTPL) mang về 2.056 tỷ đồng cho VIX, gấp hơn 7 lần khoản lãi từ cùng kỳ năm ngoái. Danh mục tự doanh của các công ty chứng khoán cho thấy, VIX, VCI, SHS đang lãi nhiều nhất nhờ tự doanh…
Trong khi đó, định giá P/B (Price to Book Ratio - Hệ số giá trên giá trị sổ sách) là một chỉ số tài chính phản ánh mối quan hệ giữa giá thị trường của cổ phiếu và giá trị sổ sách (Book Value) của doanh nghiệp. Đây là công cụ phổ biến để đánh giá xem cổ phiếu đang được định giá cao hay thấp so với giá trị tài sản ròng của doanh nghiệp.
Theo cập nhật từ báo cáo tài chính quý II, nhiều cổ phiếu vốn hoá lớn trong nhóm chứng khoán như SSI (2,6 lần), VCI (2,67 lần), MBS (2,84 lần), VIX (2,53)... có mức định giá cao hơn so với P/B trung bình của nhóm chứng khoán ước tính vào khoảng 2 lần. P/B cao cho biết cổ phiếu đang được kỳ vọng cao trên thị trường, thể hiện nhà đầu tư sẵn sàng trả một mức giá cao để sở hữu giá trị tài sản của doanh nghiệp với kỳ vọng giá trị này sẽ tăng trong tương lai.
Theo các chuyên gia, nhiều cổ phiếu của các công ty chứng khoán có khả năng tiếp tục đi lên trong ngắn và trung hạn. Trong đó, phải kể tới các động lực chính bao gồm: khả năng FTSE nâng hạng thị trường vào tháng 9/2025; thanh khoản thị trường duy trì tích cực và dư nợ ký quỹ của các công ty chứng khoán ở mức an toàn hơn nhờ hoạt động tăng vốn.
Khi được chấp thuận nâng hạng, thị trường có thể thu hút một lượng vốn đáng kể, ước tính từ 800 triệu đến 1 tỷ USD từ các quỹ thụ động mô phỏng theo chỉ số FTSE, và con số này sẽ còn lớn hơn khi tính cả các bộ chỉ số khác. Đáng chú ý, dòng vốn từ các quỹ chủ động được dự báo sẽ còn mạnh mẽ hơn, có thể đạt từ 4 - 6 tỷ USD.
Đây là yếu tố hỗ trợ rất tích cực với thị trường chứng khoán nói chung và nhóm công ty chứng khoán nói riêng trong làn sóng mới của thị trường. Trong đó, nhóm công ty chứng khoán cũng sẽ hưởng lợi trực tiếp từ sự gia tăng lợi nhuận và phí giao dịch.
Đáng chú ý, thanh khoản dồi dào là yếu tố trực tiếp thúc đẩy đà tăng của thị trường, nhờ chính sách tiền tệ nới lỏng và lãi suất ở mức thấp. Theo nhiều tổ chức tài chính, nhiều khả năng Cục Dự trữ Liên bang Mỹ (Fed) sẽ cắt giảm lãi suất 2 lần vào cuối năm 2025. Điều này hỗ trợ tích cực cho thị trường tài sản và chứng khoán toàn cầu tăng điểm.
Ở trong nước, nửa đầu năm 2025, lãi suất huy động giảm xuống thấp hơn cả giai đoạn dịch COVID-19, khiến chứng khoán trở thành kênh đầu tư hấp dẫn. Tín dụng toàn hệ thống đến tháng 7/2025 tăng 9,64%, giúp dòng tiền trên thị trường dồi dào, đẩy thanh khoản lên vùng cao mới.
Dư địa tăng trưởng dư nợ
Sự sôi động của dòng tiền vào thị trường còn thể hiện ở dư nợ ký quỹ (margin) tại các công ty chứng khoán. Trong quý II/2025, hơn 20 công ty chứng khoán có dư nợ ký quỹ ở mức hơn 1.000 tỷ đồng. Trong đó, TCBS là đơn vị cho vay nhiều nhất, ở mức hơn 33.192 tỷ đồng. SSI là công ty có dư nợ lớn thứ hai với hơn 32.820 tỷ đồng. VPBank S với dư nợ cho vay ký quỹ gần như tăng gấp đôi trong 6 tháng, từ hơn 9.400 tỷ lên 17.653 tỷ đồng, tăng tới 8.206 tỷ so với đầu năm. Tính đến cuối quý II/2025, VIX dùng hơn 9.274 tỷ đồng cho vay margin, tăng gần 3.500 tỷ trong vòng 6 tháng. Nếu tiếp tục duy trì đà tăng, VIX hoàn toàn có thể gia nhập nhóm top 5 trong quý III. Chưa kể, dư nợ cho vay margin của VIX ở mức ấn tượng, khi tỷ lệ margin/vốn chủ sở hữu mới ở mức 52%.
Theo quy định, tổng dư nợ cho vay giao dịch ký quỹ của một công ty chứng khoán không được vượt quá 200% vốn chủ sở hữu. Với đà tăng nóng thời gian qua, nhiều công ty lớn đang tiệm cận ngưỡng trần, bao gồm HSC, MBS, Mirae Asset, KIS…
Thị trường margin bùng nổ là động lực lớn với ngành chứng khoán, nhưng dự báo sẽ có sự phân hoá rõ rệt vào giai đoạn 2025-2026 với ưu thế lớn hơn cho các công ty chứng khoán còn nhiều dư địa cho vay. Trong bối cảnh này, điểm tích cực là nhiều công ty chứng khoán đã tiến hành tăng vốn điều lệ, nâng cao năng lực cho vay ký quỹ và cải thiện năng lực quản trị rủi ro. Điều này giúp thị trường hấp thụ dòng tiền margin một cách chủ động và hiệu quả hơn.
Chưa kể, lĩnh vực tài sản số đang dần đi vào khuôn khổ tại thị trường Việt Nam mở ra cơ hội tái định giá cho nhóm công ty chứng khoán với một thị trường rộng mở, quy mô lớn, nhiều tiềm năng."
25,13/08/2025 00:00,VIX: Báo cáo tỷ lệ An toàn Tài chính bán niên 2025,https://cafef.vn/du-lieu/VIX-2270392/vix-bao-cao-ty-le-an-toan-tai-chinh-ban-nien-2025.chn?utm_source=du-lieu.chn,
26,10/08/2025 00:08,"Quỹ ngoại tỷ USD thắng lớn với nhóm ngân hàng, chứng khoán, hé lộ lý do “ôm” lượng cổ phiếu VIX trị giá gần 2.000 tỷ",https://cafef.vn/quy-ngoai-ty-usd-thang-lon-voi-nhom-ngan-hang-chung-khoan-he-lo-ly-do-om-luong-co-phieu-vix-tri-gia-gan-2000-ty-188250809230907347.chn?utm_source=du-lieu.chn,"Theo báo cáo mới công bố, trong tháng 7/2025, Pyn Elite Fund đạt hiệu suất 13,25% – cao nhất trong vòng 55 tháng, kể từ tháng 1/2021. Kết quả này vượt trội so với mức tăng 9,2% của VN-Index dù chỉ số đã lập đỉnh lịch sử mới 1.557 điểm vào ngày 28/7. Động lực chính giúp quỹ ngoại này chiến thắng thị trường đến từ nhóm cổ phiếu ngân hàng và chứng khoán.
Pyn Elite Fund cho biết, từ đầu năm, quỹ đã tăng gấp đôi tỷ trọng cổ phiếu chứng khoán lên 14% bằng cách bổ sung VIX và SHS. Trong tháng 7, cổ phiếu này lần lượt tăng tới 114% và 78%, đóng góp lớn vào hiệu suấy vượt trội của quỹ. Đáng chú ý, VIX là khoản đầu tư lớn thứ 4 trong danh mục của quỹ với tỷ trọng 7,3% tính đến cuối tháng 7.
Với quy mô danh mục quản lý lên đến hơn 912,5 triệu EUR (27.000 tỷ đồng ~ 1 tỷ USD) vào cuối tháng 7, khoản đầu tư vào VIX của Pyn Elite Fund có giá trị thị trường ước tính vào khoảng 66,6 triệu EUR (~2.000 tỷ đồng).
Cổ phiếu VIX là một trong những khoản đầu tư ưa thích của Pyn Elite Fund. Quỹ từng là cổ đông lớn của công ty chứng khoán này từ khi còn tên cũ là Chứng khoán IB hồi 2016. Đến tháng 10/2018, quỹ ngoại này đã chốt lãi toàn bộ số cổ phiếu VIX nắm giữ. VIX bất ngờ trở lại top 10 khoản đầu tư của quỹ từ tháng 5 năm nay và được duy trì ít nhất cho đến cuối tháng 7 vừa qua.
Theo Pyn Elite Fund, VIX hiện là công ty môi giới lớn thứ 5 xét theo tổng vốn chủ sở hữu. Với các hoạt động kinh doanh cốt lõi là giao dịch tự doanh và cho vay ký quỹ, VIX mang lại ROE trung bình 5 năm là 19%. Đặc biệt, lợi nhuận ròng quý 2 vừa qua của VIX đã tăng vọt gấp 10,5 lần so với cùng kỳ năm ngoái lên 1.302 tỷ đồng, cao nhất nhóm công ty chứng khoán niêm yết.
Đà tăng trưởng lợi nhuận của VIX được thúc đẩy bởi hoạt động tự doanh, với các vị thế quan trọng sẵn sàng duy trì đà tăng trưởng trong nửa cuối năm 2025. Pyn Elite Fund cho biết quỹ đã tích lũy được 4,7% cổ phần vào tháng 3 khi cổ phiếu được giao dịch ở mức chiết khấu P/B 40% so với các công ty cùng ngành và vị thế này đã tạo ra lợi nhuận 127% trong khoảng thời gian 4 tháng.
Về thị trường chung, Pyn Elite Fund đánh giá tâm lý được củng cố nhờ loạt thông tin tích cực từ vĩ mô như GDP quý 2 tăng 7,96% so với cùng kỳ – vượt mọi dự báo. Chính phủ nâng mục tiêu GDP năm 2025 lên 8,3-8,5%, để tạo lực và nền tảng tăng trưởng trên 10% trong giai đoạn 2026–2030.
Chỉ số PMI đạt 52,4 điểm – cao nhất 11 tháng; xuất khẩu tăng 16% so với cùng kỳ; bán lẻ tăng 9,2%; giải ngân đầu tư công tăng 25,4%. Chính phủ nâng mục tiêu GDP năm 2025 lên 8.3–8.5%, để tạo lực và nền tảng tăng trưởng trên 10% trong giai đoạn 2026–2030. Lợi nhuận ròng của các doanh nghiệp trong danh mục đầu tư cốt lõi của quỹ tăng 32% so với cùng kỳ.
Bên cạnh đó, tháng 7 còn ghi dấu hàng loạt cột mốc với các quyết sách mang tính bước ngoặt, thể hiện sự ủng hộ doanh nghiệp và quyết tâm cải cách mạnh mẽ nhất trong nhiều thập kỷ: Quốc hội thông qua Nghị quyết 222 về thành lập Trung tâm Tài chính Quốc tế tại TP.HCM và Đà Nẵng với các ưu đãi đột phá; đề xuất sửa đổi lớn Luật Đất đai nhằm tháo gỡ nút thắt cho thị trường bất động sản; và cải cách Luật Thuế Thu nhập cá nhân để giảm gánh nặng thuế, kích thích tiêu dùng. Một cuộc cải tổ hành chính quy mô lớn cũng đã hoàn tất, giảm số tỉnh từ 63 xuống còn 34.
Ngoài ra, cơ quan quản lý đề xuất kéo dài thời gian giao dịch qua buổi trưa từ quý 1/2026 và công bố lộ trình triển khai cơ chế CCP vào quý 1/2027 - bước quan trọng mở đường cho giao dịch trong ngày. Ủy ban Chứng khoán Nhà nước cũng tái khẳng định sự tự tin vào khả năng Việt Nam được FTSE nâng hạng lên thị trường mới nổi vào tháng 10, dựa trên phản hồi tích cực về cải thiện quy định và hạ tầng kỹ thuật."
27,06/08/2025 09:36,Định giá cổ phiếu các công ty chứng khoán ra sao trước khi TCBS tiến hành IPO?,https://cafef.vn/dinh-gia-co-phieu-cac-cong-ty-chung-khoan-ra-sao-truoc-khi-tcbs-tien-hanh-ipo-188250806093655992.chn?utm_source=du-lieu.chn,"Chứng khoán Techcombank (TCBS) đang tiến những bước cuối cùng để thực hiện chào bán cổ phiếu lần đầu ra công chúng (IPO) và xa hơn là lên sàn chứng khoán. Với vị thế dẫn đầu ngành trong nhiều chỉ tiêu như vốn điều lệ, dư nợ cho vay, thương vụ này của TCBS hứa hẹn sẽ tạo ra cú huých lớn đối với cổ phiếu nhóm công ty chứng khoán.
Ở thời điểm hiện tại, sau nhịp tăng mạnh gần đây cùng đà bứt phá của thị trường chung, gần như không còn cổ phiếu nào nhóm công ty chứng khoán có P/B dưới 1. Các công ty chứng khoán lớn như SSI, HCM, VCI, VIX… có P/B dao động trong khoảng từ 2-3 lần. Trong khi đó, SHS và VND là 2 cái trên thuộc top đầu hiện đang có mức P/B dưới 2.
Các công ty chứng khoán có P/B thấp, khoảng từ 1-1,5 lần như BVS, AAS DSC, ORS,… nhìn chung quy mô khá nhỏ, vốn khiêm tốn và thị phần gần như không đáng kể. Nhóm này hoạt động tập trung vào các nghiệp vụ ngách, phục vụ khách hàng mang tính đặc thù do lợi thế cạnh tranh có phần hạn chế.
Còn với P/E - chỉ tiêu ít phổ biến hơn đối với nhóm tài chính, các công ty chứng khoán trên sàn hiện có mức định giá P/E dao động trong khoảng từ 20-40 lần. SSI, VIX, VND, SHS là những cái tên trong top đầu có P/E tương đối thấp so với mặt bằng chung. Trong khi đó, HCM và VCI có P/E tương đối cao, một phần do lợi nhuận quý 2 vừa qua sụt giảm mạnh.
Rõ ràng, các công ty chứng khoán có mức định giá cao, cũng có những lợi thế cạnh tranh nhất định như thị phần, quy mô vốn, tiềm năng tăng trưởng,… Mặt khác, một số cổ phiếu có định giá thấp đang tồn tại những vấn đề như thị phần có dấu hiệu bị thu hẹp, room cho vay còn nhiều nhưng vốn đọng ở các hoạt động đầu tư khác khiến nguồn bị hạn chế,… Những yếu tố này có thể ảnh hưởng lớn đến kỳ vọng của nhà đầu tư.
Nhìn chung, nhóm cổ phiếu các công ty chứng khoán hiện tại có định giá không thật sự rẻ nhưng vẫn còn nhiều tiềm năng tăng trưởng với những câu chuyện hấp dẫn trong thời gian tới.
Thương vụ TCBS IPO có thể tạo ra hiệu ứng định giá lại, qua đó tác động mạnh đến cổ phiếu các công ty chứng khoán. Với giá chào bán dự kiến 46.800 đồng/cổ phiếu, TCBS hiện đang được định giá ở mức hơn 97.000 tỷ đồng (3,7 tỷ USD) trước IPO. Tương ứng, chỉ số P/B vào khoảng 3,2 lần – cao hơn mức trung bình ngành.
Thực tế, định giá chỉ là một trong những yếu tố quyết định mức độ hấp dẫn của cổ phiếu. Ngoài ra, nhà đầu tư nên xem xét khẩu vị rủi ro của chính mình, nghiên cứu kỹ lưỡng các vấn đề nội tại của từng công ty chứng khoán, năng lực vốn, khả năng nắm bắt cơ hội khi nâng hạng,…
Theo nhiều tổ chức lớn trong và ngoài nước, Việt Nam có khả năng cao sẽ được FTSE Russell nâng hạng lên thị trường mới nổi loại 2 ngay trong đợt rà soát cuối năm nay. Hàng tỷ USD vốn ngoại được dự báo sẽ đổ vào chứng khoán Việt Nam khi nâng hạng qua đó thúc đẩy thị trưởng tăng trưởng cả về quy mô và thanh khoản.
Trong bối cảnh đó, các công ty chứng khoán được nhận định là một trong những nhóm cổ phiếu hưởng lợi trực tiếp. Ngoài ra, lĩnh vực tài sản số cũng dần đi vào khuôn khổ tại Việt Nam, cũng được kỳ vọng sẽ là một trong những sân chơi hấp dẫn đối với các công ty chứng khoán, bên cạnh thị trường chứng khoán truyền thống."
28,05/08/2025 17:07,VIX: Thông báo thay đổi giấy chứng nhận mẫu con dấu công ty,https://cafef.vn/du-lieu/VIX-2263825/vix-thong-bao-thay-doi-giay-chung-nhan-mau-con-dau-cong-ty.chn?utm_source=du-lieu.chn,
29,04/08/2025 00:02,"15 công ty tăng trưởng lợi nhuận 'khủng' nhất 6T2025: Đứng đầu là doanh nghiệp của tỷ phú Phạm Nhật Vượng, ngành điện góp mặt nhiều nhất",https://cafef.vn/15-cong-ty-tang-truong-loi-nhuan-khung-nhat-6t2025-dung-dau-la-doanh-nghiep-cua-ty-phu-pham-nhat-vuong-nganh-dien-gop-mat-nhieu-nhat-188250803233353437.chn?utm_source=du-lieu.chn,"Mùa báo cáo tài chính 6 tháng đầu năm 2025 đã chứng kiến nhiều doanh nghiệp đạt tốc độ tăng trưởng lợi nhuận ấn tượng, lên đến hàng nghìn phần trăm.
Dẫn đầu danh sách tăng trưởng lợi nhuận là Trung tâm Hội chợ Triển lãm Việt Nam (VEFAC, VEF) với mức tăng trưởng lên tới 8.341%, lợi nhuận trước thuế (LNTT) đạt 19.081 tỷ đồng. Nguyên nhân cho con số tăng trưởng ấn tượng này là do VEF ghi nhận doanh thu từ chuyển nhượng một phần dự án Vinhomes Global Gate là 44.560 tỷ đồng.
Ở vị trí thứ 2 là Ngân hàng TMCP Quốc Dân (NCB) với mức tăng trưởng 6.343%, ngân hàng duy nhất trong danh sách.
Bên cạnh VEF, cái tên còn lại trong khối bất động sản góp mặt ở top 15 tăng trưởng lợi nhuận cao nhất 6 tháng đầu năm là CTCP Công nghệ Viễn Thông Sài Gòn (Saigontel) tăng trưởng 2026% so với mức nền rất thấp (21.84 tỷ đồng) của 6 tháng đầu năm 2024.
Ngành điện góp mặt nhiều nhất với 4 đại diện trong đó có tới 3 doanh nghiệp thủy điện là Thủy điện Buôn Đôn ﻿(1.477%), Thủy điện Hương Sơn (1.092%), Thủy điện Vĩnh Sơn - Sông Hinh (441%). Công ty điện còn lại là Điện Gia Lai với mức tăng 400%.
Nhóm chứng khoán chiếm tới 3 vị trí trong top tăng trưởng cao nhất 6 tháng 2025 gồm: CTCP Chứng khoán LPBank (1.807%), CTCP Chứng khoán VIX (480%), CTCP Chứng khoán Hải Phòng (Haseco) (452%).
Ngành gỗ có Trường Thành với LNTT 25 tỷ đồng, tăng trưởng 3.714% so với cùng kỳ.
Bên cạnh mức tăng trưởng cao, nhiều doanh nghiệp đã chuyển từ thua lỗ trong 6 tháng đầu năm 2024 sang có lợi nhuận trong 6 tháng đầu năm 2025.
Ví dụ Tổng Công ty Phát điện 3 - EVN Genco3 (PGV) ghi nhận chuyển từ âm 942 tỷ đồng trong 6 tháng đầu năm 2024 sang lãi 987 tỷ đồng trong 6 tháng đầu năm 2025. Nhơn Trạch 2 cũng thuộc ngành điện từ lỗ 36 tỷ đồng trong cùng kỳ năm 2024 thành lợi nhuận 408 tỷ đồng.
Masan MeatLife từ lỗ 79 tỷ đồng sang lãi 364 tỷ đồng. CTCP Phát triển Đô thị Công nghiệp số 2 (D2D) ghi nhận lãi 269 tỷ một sự cải thiện đáng kể so với khoản lỗ 5 tỷ đồng cùng kỳ năm trước."
30,28/07/2025 00:00,VIX: Báo cáo tình hình quản trị công ty 06 tháng đầu năm 2025,https://cafef.vn/du-lieu/VIX-2270892/vix-bao-cao-tinh-hinh-quan-tri-cong-ty-06-thang-dau-nam-2025.chn?utm_source=du-lieu.chn,
31,24/07/2025 00:01,Những đồ thị tăng trưởng lợi nhuận ấn tượng nhất quý 2/2025: Loạt doanh nghiệp thiết lập đỉnh lịch sử mới,https://cafef.vn/nhung-do-thi-tang-truong-loi-nhuan-an-tuong-nhat-quy-22025-loat-doanh-nghiep-thiet-lap-dinh-lich-su-moi-188250723225414933.chn?utm_source=du-lieu.chn,"Theo BCTC hợp nhất quý 2/2025 của CTCP Nam Việt (Navico, HOSE: ANV), doanh thu thuần đạt 1.726 tỷ đồng, tăng 45% so với cùng kỳ năm trước do sản lượng tăng, giá bán tăng. Lợi nhuận sau thuế hợp nhất quý 2/2025 đạt 333 tỷ đồng, tăng 335 tỷ đồng so với cùng kỳ năm trước.﻿ Đây là mức cao nhất kể từ khi công ty này lên sàn giao dịch Upcom năm 2017.
Doanh thu thuần tăng 18% so với cùng kỳ năm trước, Nhựa Tiền Phong (NTP) đạt lợi nhuận sau thuế theo quý lớn nhất lịch sử, với 321 tỷ đồng - tăng 35% so với quý 2/2024., kỷ lục cũ (238 tỷ đồng).
Chứng khoán VIX gây bất ngờ với mức lợi nhuận gấp hơn 10 lần cùng kỳ lên 1.311 tỷ đồng - cao thứ 2 ngành chứng khoán chỉ sau TCBS.
Đầu tư Phát triển Máy Việt Nam (VIMID -VVS) công bố báo cáo tài chính quý 2/2025 với doanh thu thuần trong quý đạt 2.078 tỷ đồng, tăng 98,4% so với cùng kỳ năm trước. Lợi nhuận sau thuế của công ty đạt hơn 55 tỷ đồng, tăng 375% so với cùng kỳ năm 2024.
DAP - VINACHEM (DDV) công bố báo cáo tài chính quý 2/2025 với lợi nhuận sau thuế tăng 140% so với cùng kỳ năm trước, đạt hơn 153 tỷ đồng. Đây là quý thứ 4 liên tiếp DDV
Doanh thu tăng chủ yếu do tăng sản lượng bán hàng và giá bán bình quân kỳ này
tăng so với cùng kỳ năm trước (giá bán bình quân kỳ này là 16,24 trđ/tấn, tăng 3,56 trđ/tấn so vói cùng kỳ năm trước;
sản lượng DAP tiêu thụ tăng 2.666 tấn, tương ứng tăng 3,7% so với cùng kỳ năm trước.) Ngoài ra, kỳ này phát sinh
doanh thu từ việc bán Amoniac tăng cao so với cùng kỳ năm trước (tăng 362.137 trđ)."
