Unnamed: 0,Thời gian,Tiêu đề,URL,content
49,08/06/2025 15:04,Chứng khoán VIX sắp phát hành gần 73 triệu cổ phiếu trả cổ tức năm 2024,https://cafef.vn/chung-khoan-vix-sap-phat-hanh-gan-73-trieu-co-phieu-tra-co-tuc-nam-2024-188250608150421573.chn?utm_source=du-lieu.chn,"Công ty Cổ phần Chứng khoán VIX (MCK: VIX, sàn HoSE) vừa công bố Nghị quyết của Hội đồng quản trị về việc chốt danh sách cổ đông để thực hiện trả cổ tức năm 2024 bằng cổ phiếu.
Theo đó, Chứng khoán VIX dự kiến phát hành hơn 72,9 triệu cổ phiếu để trả cổ tức cho cổ đông với tỷ lệ thực hiện quyền 20:1, tức cổ đông sở hữu 20 cổ phiếu sẽ được nhận 1 cổ phiếu mới. Ngày đăng ký cuối cùng thực hiện quyền là 19/6/2025.
Tổng giá trị phát hành tính theo mệnh giá là hơn 729 tỷ đồng. Nguồn vốn được lấy từ lợi nhuận sau thuế chưa phân phối trên báo cáo tài chính năm 2024 đã kiểm toán của công ty.
Nếu phát hành cổ phiếu thành công như kế hoạch, vốn điều lệ của Chứng khoán VIX sẽ tăng từ 14.585 tỷ đồng lên hơn 15.314 tỷ đồng.
Ảnh minh họa
Được biết, phương án chi trả cổ tức nêu trên đã được các cổ đông của Chứng khoán VIX thông qua tại cuộc họp Đại hội đồng cổ đông (ĐHĐCĐ) thường niên năm 2025 diễn ra ngày 23/5/2025.
Ngoài ra, Đại hội cũng đã thông qua Báo cáo của HĐQT về quản trị và kết quả hoạt động của HĐQT, từng thành viên HĐQT năm 2024; Báo cáo của BKS về kết quả kinh doanh của công ty, kết quả hoạt động của HĐQT, Tổng Giám đốc năm 2024; Báo cáo tự đánh giá kết quả hoạt động của BKS và từng thành viên BKS năm 2024; Tờ trình về việc thông qua BCTC năm 2024 đã kiểm toán, kết quả kinh doanh năm 2024;...
Đồng thời, thông qua chỉ tiêu kế hoạch kinh doanh năm 2025 với lợi nhuận trước thuế 1.500 tỷ đồng và lợi nhuận sau thuế 1.200 tỷ đồng, tăng lần lượt 84% và 81% so với thực hiện năm 2024.
Trong một diễn biến khác, mới đây Chứng khoán VIX vừa có thông báo gửi đến Ủy ban Chứng khoán Nhà nước (UBCKNN), Sở Giao dịch Chứng khoán Việt Nam, Sở Giao dịch Chứng khoán TP.HCM (HoSE) liên quan đến vấn đề nhân sự.
Cụ thể, căn cứ theo Nghị quyết số 01/2025/VIX/NQ-ĐHCĐ ngày 23/5/2025 của Đại hội đồng cổ đông (ĐHĐCĐ) thường niên năm 2025, VIX tiến hành miễn nhiệm chức vụ Thành viên HĐQT đối với ông Thái Hoàng Long và bà Trần Thị Hồng Hà kể từ ngày 23/5/2025. Lý do miễn nhiệm là theo đơn từ nhiệm và được ĐHĐCĐ thông qua.
Ở chiều ngược lại, ông Đỗ Ngọc Đĩnh- Phó Tổng Giám đốc và ông Hà Huy Hùng, được bổ nhiệm giữ vị trí thành viên HĐQT Chứng khoán VIX kể từ ngày 23/5/2025."
50,28/05/2025 10:12,Biến động nhân sự tại Chứng khoán VIX,https://cafef.vn/bien-dong-nhan-su-tai-chung-khoan-vix-188250528101245317.chn?utm_source=du-lieu.chn,"Công ty CP Chứng khoán VIX (MCK: VIX) vừa có thông báo gửi UBCKNN, Sở Giao dịch Chứng khoán Việt Nam, HoSE liên quan đến vấn đề nhân sự.
Cụ thể, căn cứ theo Nghị quyết số 01/2025/VIX/NQ-ĐHCĐ ngày 23/5/2025 của Đại hội đồng cổ đông (ĐHĐCĐ) thường niên năm 2025, VIX tiến hành miễn nhiệm chức vụ Thành viên HĐQT đối với ông Thái Hoàng Long và bà Trần Thị Hồng Hà kể từ ngày 23/5/2025. Lý do miễn nhiệm là theo đơn từ nhiệm và được ĐHĐCĐ thông qua.
Ở chiều ngược lại, ông Đỗ Ngọc Đĩnh- Phó Tổng Giám đốc và ông Hà Huy Hùng, được bổ nhiệm giữ vị trí thành viên HĐQT Chứng khoán VIX kể từ ngày 23/5/2025.
Trước đó, ngày 23/5/2025, Chứng khoán VIX đã tổ chức thành công ĐHĐCĐ thường niên năm 2025, thông qua nhiều nội dung quan trọng.
Cụ thể, đại hội đã thông qua Báo cáo của HĐQT về quản trị và kết quả hoạt động của HĐQT, từng thành viên HĐQT năm 2024; Báo cáo của BKS về kết quả kinh doanh của công ty, kết quả hoạt động của HĐQT, Tổng Giám đốc năm 2024; Báo cáo tự đánh giá kết quả hoạt động của BKS và từng thành viên BKS năm 2024; Tờ trình về việc thông qua BCTC năm 2024 đã kiểm toán, kết quả kinh doanh năm 2024;...
ĐHĐCĐ Chứng khoán VIX đã thông qua chỉ tiêu kế hoạch kinh doanh năm 2025 với lợi nhuận trước thuế 1.500 tỷ đồng và lợi nhuận sau thuế 1.200 tỷ đồng, tăng lần lượt 84% và 81% so với thực hiện năm 2024.
Ngoài ra, cổ đông cũng thông qua phương án phát hành cổ phiếu để trả cổ tức năm 2024 với tỷ lệ 5%.
Theo đó, doanh nghiệp dự kiến phát hành hơn 72,9 triệu cổ phiếu để trả cổ tức. Thời gian dự kiến thực hiện cuối quý II - đầu quý III/2025 sau khi được UBCKNN chấp thuận.
Nếu phát hành cổ phiếu thành công như kế hoạch, vốn điều lệ của Chứng khoán VIX sẽ tăng từ 14.585 tỷ đồng lên hơn 15.314 tỷ đồng."
51,28/05/2025 00:00,VIX: Nghị quyết HĐQT triển khai phương án phát hành cổ phiếu để trả cổ tức năm 2024,https://cafef.vn/du-lieu/VIX-2208520/vix-nghi-quyet-hdqt-trien-khai-phuong-an-phat-hanh-co-phieu-de-tra-co-tuc-nam-2024.chn?utm_source=du-lieu.chn,
52,28/05/2025 00:00,VIX: Nghị quyết HĐQT bổ nhiệm ông Nguyễn Tuấn Dũng giữ chức Chủ tịch HĐQT từ 28.5.2025,https://cafef.vn/du-lieu/VIX-2208539/vix-nghi-quyet-hdqt-bo-nhiem-ong-nguyen-tuan-dung-giu-chuc-chu-tich-hdqt-tu-2852025.chn?utm_source=du-lieu.chn,
53,28/05/2025 00:00,VIX: Bổ nhiệm bà Trần Hồng Vân giữ chức Trưởng BKS từ 28.5.2025,https://cafef.vn/du-lieu/VIX-2208654/vix-bo-nhiem-ba-tran-hong-van-giu-chuc-truong-bks-tu-2852025.chn?utm_source=du-lieu.chn,
54,28/05/2025 00:00,VIX: Bổ nhiệm ông Dư Văn Toàn phụ trách quản trị công ty từ 28.5.2025,https://cafef.vn/du-lieu/VIX-2208656/vix-bo-nhiem-ong-du-van-toan-phu-trach-quan-tri-cong-ty-tu-2852025.chn?utm_source=du-lieu.chn,
55,27/05/2025 00:00,VIX: Thông báo thay đổi nhân sự công ty - bổ sung bản cung cấp thông tin,https://cafef.vn/du-lieu/VIX-2207737/vix-thong-bao-thay-doi-nhan-su-cong-ty-bo-sung-ban-cung-cap-thong-tin.chn?utm_source=du-lieu.chn,
56,26/05/2025 00:00,VIX: Biên bản họp và Nghị quyết ĐHĐCĐ thường niên năm 2025,https://cafef.vn/du-lieu/VIX-2206817/vix-bien-ban-hop-va-nghi-quyet-dhdcd-thuong-nien-nam-2025.chn?utm_source=du-lieu.chn,
57,26/05/2025 00:00,"VIX: Bổ nhiệm ông Đỗ Ngọc Đĩnh, ông Hà Huy Hùng làm Thành viên HĐQT từ 23.5.2025",https://cafef.vn/du-lieu/VIX-2206818/vix-bo-nhiem-ong-do-ngoc-dinh-ong-ha-huy-hung-lam-thanh-vien-hdqt-tu-2352025.chn?utm_source=du-lieu.chn,
58,23/05/2025 19:30,"Chứng khoán VIX đặt mục tiêu lợi nhuận tăng 1,8 lần năm 2025",https://cafef.vn/chung-khoan-vix-dat-muc-tieu-loi-nhuan-tang-18-lan-nam-2025-188250523191746103.chn?utm_source=du-lieu.chn,"Chứng khoán VIX đặt mục tiêu lợi nhuận nghìn tỷ
Đại hội đồng cổ đông (ĐHCĐ) vừa diễn ra của Công ty cổ phần Chứng khoán VIX (VIX) đã thông qua các báo cáo và kế hoạch kinh doanh năm 2025. Trong đó, Chứng khoán VIX đặt mục tiêu lợi nhuận trước thuế 1.500 tỷ đồng, tăng 184% so với kết quả thực hiện năm 2024. Lợi nhuận sau thuế dự kiến đạt 1.200 tỷ đồng, tăng 181%.
Theo VIX, Công ty đặt kế hoạch tăng trưởng tích cực năm 2025 bởi định hướng phát triển môi giới và tự doanh làm nền tảng trong các mảng hoạt động chính đang cho thấy đây là hướng đi đúng đắn trong giai đoạn hiện tại.
Đáng chú ý, cơ hội nâng hạng thị trường trong tháng 9/2025 là hiện hữu. Thông tư 68/2024 của Bộ Tài chính đã thiết lập khung pháp lý để phát triển sản phẩm nhằm đáp ứng các tiêu chí nâng hạng thị trường của cả FTSE và MSCI. Cùng với đó, hệ thống KRX vận hành thuận lợi vào tháng 5/2025 cũng là bước tiến gần hơn tới mục tiêu nâng hạng.
Theo kịch bản cơ sở được các doanh nghiệp chứng khoán đặt ra, thị trường chứng khoán Việt Nam có thể được MSCI xem xét đưa vào danh sách theo dõi (Watch list trong tháng 6/2025) và FTSE Russell ra thông báo chấp thuận nâng hạng vào tháng 9/2025.
Trong bối cảnh này, Chứng khoán VIX sẽ bám sát các định hướng phát triển thị trường chứng khoán của Chính phủ năm 2025 và các năm tiếp theo, chuẩn bị nguồn lực để sẵn sàng đáp ứng các thay đổi của thị trường về sản phẩm và cơ chế vận hành khi thị trường đang càng ngày càng tiến gần tới mục tiêu nâng hạng.
Chứng khoán VIX đặt mục tiêu lợi nhuận trước thuế 1.500 tỷ đồng, tăng 184% so với kết quả thực hiện năm 2024. Lợi nhuận sau thuế dự kiến đạt 1.200 tỷ đồng, tăng 181%.
Năm 2025 được nhận định tuy thị trường đối diện nhiều thách thức, nhưng vẫn có những cơ hội nhất định. Đáng chú ý là cơ hội đầu tư cổ phiếu tốt ở mức giá hợp lý. Với những đặc trưng hiện tại của thị trường chứng khoán, VN-Index đang trong giai đoạn phân phối, khối ngoại tiếp tục xu hướng bán ròng và nền kinh tế toàn cầu nhiều biến động, nhìn chung thị trường chứng khoán năm 2025 sẽ có sự phân hoá lớn và yếu tố cơ bản sẽ dẫn dắt giá cổ phiếu. Cụ thể, sẽ luôn có những cổ phiếu của doanh nghiệp có nền tảng kinh doanh vững chắc, dòng tiền ổn định. Do vậy, khi giá cổ phiếu này điều chỉnh theo thị trường chung, cơ hội đầu tư giá trị sẽ xuất hiện.
Một nội dung khác được đa số nhà đầu tư và cổ đông quan tâm là thông tin về cổ tức. Cụ thể, ĐHCĐ VIX đã thông qua phương án chi trả cổ tức năm 2024 tỷ lệ 5% bằng cổ phiếu, trích từ lợi nhuận sau thuế đã thực hiện chưa phân phối trên BCTC năm 2024 đã kiểm toán, giá trị dự kiến là hơn 729 tỷ đồng. Mức cổ tức này được tính trên số vốn điều lệ hiện tại của Công ty là hơn 14.585 tỷ đồng.
Củng cố nội lực
Trên cơ sở đánh giá những thách thức và cơ hội của thị trường chứng khoán năm 2025, VIX xác định sẽ tập trung nâng cao năng lực tài chính và năng lực quản trị; tiếp tục phát triển, đẩy mạnh các mảng hoạt động nghiệp vụ của Công ty nhằm tối đa hoá hiệu quả hoạt động mà mũi nhọn là hoạt động nghiệp vụ môi giới chứng khoán và hoạt động nghiệp vụ đầu tư tự doanh chứng khoán…
Chia sẻ tại Đại hội, Chứng khoán VIX cho biết, chất lượng nguồn nhân lực là một trong những yếu tố quan trọng quyết định sự phát triển của Công ty. Do đó, VIX luôn đặt mục tiêu xây dựng đội ngũ nhân viên chuyên nghiệp lên hàng đầu trong chiến lược phát triển. Hiện tại, đội ngũ nhân sự của VIX trẻ, năng động, nhiệt huyết và có năng lực chuyên môn tốt.
Một trong những minh chứng là trong năm 2024, khi thị trường diễn biến không thuận lợi, VIX đã thực hiện đầu tư tự doanh vào các cổ phiếu và trái phiếu được đánh giá là có tiềm năng trên thị trường. Hoạt động đầu tư này đã mang lại hiệu quả cao cho VIX, doanh thu chiếm 64,8% tổng doanh thu cả Công ty, tăng 11,9% so với doanh thu năm 2023.
Trong thời gian tới, Công ty sẽ tiếp tục đẩy mạnh đào tạo, thúc đẩy mảng kinh doanh chính là tự doanh và môi giới, tạo ra lợi thế cạnh tranh và giá trị cho khách hàng bằng chất lượng dịch vụ, chăm sóc khác hàng và cả năng lực công nghệ, bao gồm ứng dụng trí tuệ nhân tạo (AI) vào tư vấn đầu tư.
Chứng khoán VIX đã đầu tư và phát triển hạ tầng công nghệ hiện đại, triển khai dự án Hệ thống giao dịch chứng khoán hoàn toàn mới (Xpower) và đưa vào vận hành chính thức từ ngày 27/01/2024.
Hệ thống đã mang lại những tiện ích vượt trội tới nhà đầu tư như tăng tốc độ xử lý lệnh, bổ sung các tiện ích giao dịch, giúp nhà đầu tư quản lý tài sản và thực hiện đầu tư một cách thuận tiện, nhanh chóng và hiệu quả. Ngoài ra, XPower còn được tích hợp với công nghệ trí tuệ nhân tạo (AI) đưa ra được những khuyến nghị hỗ trợ nhà đầu tư trong quá trình giao dịch. Hệ thống XPower là nền tảng cơ sở để tích hợp các sản phẩm, dịch vụ mới trong tương lai.
VIX cũng đã hoàn thành việc việc xây dựng/nhận diện hình ảnh thông qua việc đổi mới website Công ty, vừa mang tính hiện đại vừa thân thiện với người sử dụng, đồng thời cũng là nơi quảng bá các sản phẩm dịch vụ mà VIX cung cấp cho khách hàng.
Năm 2025, VIX cho biết sẽ tiếp tục đẩy mạnh đầu tư hạ tầng công nghệ thông tin nhằm nâng cao năng lực xử lý, bổ sung năng lực lưu trữ và an toàn bảo mật hệ thống. Trong đó, VIX đã hợp tác với các đơn vị cung cấp về dịch vụ an toàn, an ninh mạng, thường xuyên rà soát các lỗ hổng bảo mật của hệ thống giao dịch chứng khoán nhằm đảm bảo sự hoạt động an toàn của hệ thống."
59,21/05/2025 00:00,VIX: Đơn xin từ nhiệm của bà Trần Thị Hồng Hà - Thành viên HĐQT,https://cafef.vn/du-lieu/VIX-2204137/vix-don-xin-tu-nhiem-cua-ba-tran-thi-hong-ha-thanh-vien-hdqt.chn?utm_source=du-lieu.chn,
60,21/05/2025 00:00,VIX: Nghị quyết HĐQT về việc bầu bổ sung Thành viên HĐQT,https://cafef.vn/du-lieu/VIX-2204138/vix-nghi-quyet-hdqt-ve-viec-bau-bo-sung-thanh-vien-hdqt.chn?utm_source=du-lieu.chn,
61,26/04/2025 16:24,VIX: Thông báo mời họp và tài liệu ĐHĐCĐ thường niên năm 2025,https://cafef.vn/du-lieu/VIX-2227287/vix-thong-bao-moi-hop-va-tai-lieu-dhdcd-thuong-nien-nam-2025.chn?utm_source=du-lieu.chn,
62,26/04/2025 00:00,VIX: Thông báo mời họp và tài liệu ĐHĐCĐ thường niên năm 2025,https://cafef.vn/du-lieu/VIX-2192475/vix-thong-bao-moi-hop-va-tai-lieu-dhdcd-thuong-nien-nam-2025.chn?utm_source=du-lieu.chn,
63,25/04/2025 20:30,Chứng khoán VIX đặt mục tiêu gia nhập nhóm lợi nhuận nghìn tỷ,https://cafef.vn/chung-khoan-vix-dat-muc-tieu-gia-nhap-nhom-loi-nhuan-nghin-ty-188250425193419674.chn?utm_source=du-lieu.chn,"Kế hoạch tăng trưởng tích cực
Theo tài liệu ĐHCĐ, năm 2025, Chứng khoán VIX đặt mục tiêu lợi nhuận trước thuế 1.500 tỷ đồng, tăng 184% so với kết quả thực hiện năm 2024. Lợi nhuận sau thuế dự kiến đạt 1.200 tỷ đồng, tăng 181%.
Theo VIX, Công ty đặt kế hoạch tăng trưởng tích cực năm 2025 bởi định hướng phát triển môi giới và tự doanh làm nền tảng trong các mảng hoạt động chính đang cho thấy đây là hướng đi đúng đắn trong giai đoạn hiện tại.
Nhìn lại năm 2024, thị trường chứng khoán Việt Nam được đánh giá là có nhiều khó khăn: Mặc dù chỉ số VN-Index đóng cửa ở mức 1.266 điểm, tăng 136 điểm (tương đương 12%) so với cuối năm 2023, nhưng diễn biến chủ yếu của thị trường là giai đoạn phân phối với 3 đặc trưng chính là: Các mã cổ phiếu có vốn hoá lớn bị giảm giá khá mạnh, ảnh hưởng nhiều đến tâm lý nhà đầu tư; khối ngoại bán ròng với khối lượng rất lớn (94.000 tỷ đồng, tăng 347% so với năm 2023); và các dòng cổ phiếu có sự phân hoá khá mạnh.
Trong bối cảnh đó, doanh thu tự doanh năm 2024 của Công ty đạt 1.197 tỷ đồng chiếm 64,8% tổng tỷ trọng doanh thu và tăng 11,9% so với doanh thu năm 2023. Với diễn biến khó khăn của thị trường chứng khoán năm 2024, việc tăng trưởng doanh thu trong hoạt động đầu tư tự doanh của VIX đáng được ghi nhận.
Về hoạt động môi giới, doanh thu phí giao dịch của VIX trong năm 2024 đạt 135 tỷ đồng tăng 48,7 tỷ đồng tương ứng 56,4% so với năm 2023. Dư nợ margin của VIX tăng từ 3.008 tỷ đồng (năm 2023) lên đến 5.774 tỷ đồng tương đương với mức tăng 91,9%.
Trên cơ sở đánh giá những thách thức và cơ hội của thị trường chứng khoán năm 2025, VIX xác định sẽ tập trung nâng cao năng lực tài chính và năng lực quản trị; tiếp tục phát triển, đẩy mạnh các mảng hoạt động nghiệp vụ của Công ty nhằm tối đa hoá hiệu quả hoạt động mà mũi nhọn là hoạt động nghiệp vụ môi giới chứng khoán và hoạt động nghiệp vụ đầu tư tự doanh chứng khoán…
Bên cạnh đó, Công ty sẽ bám sát các định hướng phát triển thị trường chứng khoán của Chính phủ năm 2025 và các năm tiếp theo, chuẩn bị nguồn lực để sẵn sàng đáp ứng các thay đổi của thị trường về sản phẩm và cơ chế vận hành khi thị trường đang càng ngày càng tiến gần tới mục tiêu nâng hạng.
Cũng theo tài liệu Đại hội, Chứng khoán VIX dự kiến trình cổ đông phê duyệt mức chi trả cổ tức năm 2024 tỷ lệ 5% bằng cổ phiếu, trích từ lợi nhuận sau thuế đã thực hiện chưa phân phối trên BCTC năm 2024 đã kiểm toán, giá trị dự kiến là hơn 729 tỷ đồng. Mức cổ tức này được tính trên số vốn điều lệ hiện tại của Công ty là hơn 14.585 tỷ đồng.
Hạ tầng công nghệ sẵn sàng
Một điểm nhấn của VIX trong năm 2024 là việc tập trung đầu tư và phát triển hạ tầng công nghệ. Cụ thể, VIX đã hợp tác cùng Công ty cổ phần Giải pháp phần mềm Tài chính FSS để triển khai dự án Hệ thống giao dịch chứng khoán hoàn toàn mới (Xpower) và đưa vào vận hành chính thức từ ngày 27/01/2024.
Hệ thống đã mang lại những tiện ích vượt trội tới nhà đầu tư như tăng tốc độ xử lý lệnh, bổ sung các tiện ích giao dịch, giúp nhà đầu tư quản lý tài sản và thực hiện đầu tư một cách thuận tiện, nhanh chóng và hiệu quả. Ngoài ra, XPower còn được tích hợp với công nghệ trí tuệ nhân tạo (AI) đưa ra được những khuyến nghị hỗ trợ nhà đầu tư trong quá trình giao dịch. Hệ thống XPower là nền tảng cơ sở để tích hợp các sản phẩm, dịch vụ mới trong tương lai.
VIX cũng đã hoàn thành việc xây dựng/nhận diện hình ảnh thông qua việc đổi mới website Công ty, vừa mang tính hiện đại vừa thân thiện với người sử dụng, đồng thời cũng là nơi quảng bá các sản phẩm dịch vụ mà VIX cung cấp cho khách hàng.
Hiện tại, nhân sự cũng như hệ thống giao dịch chứng khoán của VIX đã sẵn sàng đáp ứng được phương án kết nối (golive) hệ thống KRX theo yêu cầu của các cơ quan chức năng (Dự kiến hệ thống KRX sẽ đi vào vận hành trong tháng 5/2025).
Năm 2025, VIX cho biết sẽ tiếp tục đẩy mạnh đầu tư hạ tầng công nghệ thông tin nhằm nâng cao năng lực xử lý, bổ sung năng lực lưu trữ và an toàn bảo mật hệ thống. Trong đó, VIX đã hợp tác với các đơn vị cung cấp về dịch vụ an toàn, an ninh mạng, thường xuyên rà soát các lỗ hổng bảo mật của hệ thống giao dịch chứng khoán nhằm đảm bảo sự hoạt động an toàn của Hệ thống.
Mục tiêu và chiến lược trung, dài hạn của VIX là trở thành một công ty chứng khoán mạnh và chuyên nghiệp, là lựa chọn hàng đầu của các nhà đầu tư, tham gia vào nhóm các công ty chứng khoán hàng đầu trên thị trường về quy mô vốn và hiệu quả hoạt động.
Trong đó, các giải pháp trọng tâm bao gồm: Đẩy mạnh mảng môi giới, tạo ra lợi thế cạnh tranh và giá trị cho khách hàng bằng công nghệ, chất lượng dịch vụ và chăm sóc khách hàng, trong đó việc phát triển các sản phẩm mới, bao gồm ứng dụng trí tuệ nhân tạo (AI) vào tư vấn đầu tư, sẽ là một hướng đi quan trọng. Coi trọng hiệu quả hoạt động, đặt hiệu quả và giá trị mang lại cho cổ đông lên trên hết; làm tốt hơn nữa những sản phẩm và dịch vụ  hiện có, nâng cao hiệu quả hoạt động của Công ty song song với quản trị rủi ro chặt chẽ."
64,23/04/2025 00:00,VIX: Nghị quyết HĐQT thông qua hạn mức vay vốn tại tổ chức tín dụng,https://cafef.vn/du-lieu/VIX-2186412/vix-nghi-quyet-hdqt-thong-qua-han-muc-vay-von-tai-to-chuc-tin-dung.chn?utm_source=du-lieu.chn,
